sticker_id,labeled_queries
5893293483480846389.webm,"clap, yay, happy, clap clap, claps claps, clapping, rabbit clapping, awesome"
5895305392191181394.webm,"oof, my bad, sowwie, that must have hurt, sorry, im sowwie, i apologise, i cant believe it, im upset, despair"
5895692132521349311.webm,"point and laughing, lmao max, laughing with saliva, this is funny asf, funny asf, HAHAHAH, Points, Laughing, Ahahahaha"
5897483975697369954.gif,"Nono, ä¸å¯ä»¥, Covers mouth, no no no, tearing up"
5897729738021016380.png,"eat food, nonchalant, Mmmm, Awkward"
5899831836749598966.webm,"dancing, dancing like audition, dancing queen, oh yeah, moving anime queen"
5899997613897290824.webm,"die, wreaking ball, collision"
5900165130506736614.png,"zz, cool eyes, Handsome eyes, Killer eyes, Silent killing, Stare"
5900234928020263880.webm,"control my ghosts, control ghosts, control, leash ghost, take it back"
5901988597526958014.webm,"godzilla bunny, roar, dino onesie, dino bunny, roarrrrrr, rabbit dinosaur outfit roar, screaming, making sound, talking"
5902138311496961471.webm,"wowziz!, amazing!, amazeballs, yay!, sparkles, bling, happy, wow, thanks!, cute, rabbit"
5902179835240779496.webm,"xixixixix, hehehehe, hands covering mouth laughing, dont tell you, heheheheheheehehhehehehe, bouncing up and down grinning, hands over mouth grinning, hahahahaha, lol"
5902399582947511845.webm,"rolling, can't be helped, rolling around, sigh, cry"
5904354244038758803.webm,"hmph, bunny blow air, bunny puff air, pfft, tada, stand up straight"
5904476457333166405.webm,"using computer, finding, rabbit surfing the net, working hard, hardworking, bunny working"
5904737114603392552.webm,"sigh, pffft, hais, super sad, feels bad"
5906490874304400689.webm,"jiayou!, gambatte, all the best, good luck!, go for it!, go for it~, åŠ æ²¹ï¼, add oil, gambateh"
5906545158396053364.gif,"blehhehehehehh, stick out tongue, blehhhhh, you cant catch me, teehee, tongue out, silly bubble head"
5906757196636490844.webm,"tired, ç´¯, ded, sad, doge"
5906877382706334943.webm,"approved, 10 10 10, 10/10, hundred hundred"
5906916363829513720.webm,"Hug, Cat and rabbit, Its okk, Touch head, pat pat, its ok, comfort, sayang"
5909118926138117757.webm,"band aid, surrender, bush, rabbit, shake head, gg, ff, give up, die liao"
5911124203418948287.png,"go now!, anime blow whistle, cute command, call it, donezo, chibi, whistle"
5913347312851095087.png,"hehehe, im right you're wrong, i'm right, smug, confident, smug guy, smirking, hmph"
5913405771650961570.png,"hands over chest, mmmh, yes yes, hmph, guy in costume"
5913466923395321776.webm,"so cuteee, gimme, Arghhhhhh!, Bangs table"
5913575714916929919.png,"fan, smacking fan"
591357721815548973.png,"reading the quran, reading, disturbing me, im busy"
5915590363816397427.webm,"nod of approval, zooming into face nodding"
5915732643198012618.webm,"bye, bunny, run away, see you"
5917795060723747611.webm,"thumbs up, rabbit, yes, agreed, nice one, good job"
5917981522433937575.webm,"relax, chill, drink tea, rocking chair, relaxed, sipping tea, laying back"
5918108065055378603.webm,"?, where?, how?, question, question mark, ????, what?, huh"
5918135685990059497.webm,"swaying side to side, do you agree?, crazy swaying, yes yes yes yes, madness agree, æ‘‡é’±æ ‘, right?, happy"
5918223801539103924.webm,"eh?, what do you mean, jjk toji, question mark, what?, huh?, ?, anime man, gojo"
5920439850045018016.webm,"nod, deadpan, agree, approve, Nod nod, Yupp, Yes, Anime"
5922255337016003283.png,"Gab when he see cards, rich, moolah, froggo, say no more, take my money"
5924616383617829814.webm,"crying, sad, sadded, angry, confused, wa sian sia, so sad, im sad, cry"
5924714326052046755.gif,"Cries, Very upset, Hand on table, Whyyyyyyy, sobs, not fair, this is not fair, upset, very sad, clenched fist not fair"
5924757030911871492.gif,"chiong, running, on the way, rushing, run, running carrying a heart, running with my heart, lets go, heart in hand"
5924964821429651550.gif,"rolling side to side, upside down, rolling on pillow, upside down rolling, chill"
5924972500831176996.gif,"running with flowers, enen~, running, flower running, chill, blushing face, dazzling run"
5929305689041145428.png,"staring at the ceiling, thinking, goodnight, oyasumi, nightz, night, Going to sleep, Lying on bed, Genshin, Handsome guy"
5931667401362902344.png,"human size bug, bed bug, disgusting bed bug"
5933496060998586283.png,bee stung face dog
5933850146692401849.gif,"sipping drink, mmh, chill"
593535622421938286.png,"cat in blanket, sian face, angry face, tired, just woke up, bed face, blanket, so done with life, want to take mc, mmmh, wrapped up in blanket, :3, cozy, scrunchy face, Cat, Bacon wrapped around"
593535622421938307.png,"angry, cat, hmph, you make me mad, upset, frown, cat frowning"
5935860968776010451.webm,"give you flower, give flower, be my wife, accept me, be my wife~, give you rose"
5935958022151997370.gif,"noooooooo, cry, indespair, super upset, shaking from sadness, nuuuuu, tears streaming down the face, pig sad, throwing tantrum, hands waving up and down, upset"
5938203044507289703.gif,"miss you, holding cat twirling around, twirling, Hugging and spinning, Arhhhhh"
5938265192684063360.gif,"look at my booty, twisting my waist, shaking my waist, cat bear shaking butt, HangSeed, Dancing, Happy, Cat, Relax"
5938490197430766465.gif,"yayayayay, paws flipping up and down, shaking from happiness, pitty patty, happy, excited, moving hands up and down"
5942635047029837738.png,"what do you mean?, prawn smoking cigarettes, smoke"
5942678451969330586.png,"GM, prawn, TADA, Good morning"
5947355366411995366.png,cross-hand smile
5947465111416343448.gif,"shrug, meh, just woke up, what do you want, restless, so done with life, emotionless, speechless, -_-, what happened, huh, nonchalent, expressionless"
5951893192633748300.webm,"kunguf klick, wrong target, violence, æ‰“é”™äºº, Misdamage"
5954169048559259089.png,"cant save you, dragging baggage, kazuha, dragging, burden"
5956149402144869749.png,"rug, leg, carpet, go die"
5956351347212160252.png,"zen, chill, making peace, sad anime character, careless powerful girl anime character, goddess"
5958821670666899521.webm,"thumbs up, great, duck awesome, noted, bird, yellow feet"
5960880111052917681.webm,"bouncing white duck, wheeee, excited waiting, excited, bouncing up and down, chicken bouncing up and down"
5963057680946826865.webm,"dance cat belly, oh yeah~, cat big belly dancing, awesome, relaxing time~, party time~, cat belly dance bottom pov, cat fat belly dance"
5965095063108193138.gif,"Haiss, Lie down, Like that lorr, What to do, happy cat laying on stomach, happy gray cat, chill gray cat, cat with happy ears"
5965289088255789177.png,"huh, blur, damn blur, big eyes with dot, ah?, huh?, clueless, lost, dumb pokemon, ditto bubblesaur, o.o"
5967454280053952396.png,"drink bear, cheers!, Drink beer"
5967494347803856223.png,"hug, huggieee, There there, Iâ€™m here, Hugs, We in this tgt, We only have each other, ç›¸ä¾ä¸ºå‘½, Cat"
5967572172611258871.webm,"Dancing bunny, Disco, Happy, Thank you, please please please, bunny saying please, please begging hands"
5967762602871231222.webm,"nonchalent, emotionless, it is what it is, Small nod, Agree nod"
5969645241655888996.webm,"Looking through window, Come see see, What you have to hide, let me see, i want to see, face pressed against window, what are you hiding, i also want this"
5969676577737279720.gif,"angry angry, angry, smoke coming out of ears, EAM EAM, munching down, triangle teeth, furious, bite you, clenching teeth, biting down hard, fumes coming out"
5969759543620538230.png,"NAHIDA, KID ELF, PEDO, Hi, What you doing?, Are you there?, Stare, Genshin, å’‹åœ°ï¼Ÿ"
5969768352598463226.webm,"tongue out, é¬¼è„¸, cute blue anime, bleh, gotcha, chibi anime girl"
5969784454430855433.webm,"sad, sad max, super sad, crying, cri, cry, baby, tears falling down my face"
5969832858712280810.png,"shrug, chilling, side by side, Same same but different, Opposites, Genshin, Boys"
5971992544362368318.webm,"Spy family, Eyes got sparkle, Waohhh, å´‡æ‹œ, waku waku, spyxfamily anya, anya sparkly eyes, wahhhh"
5972058394800950772.webm,"yayayada, running with rabbit with hand, running, happy, give you, give you present, coming to give you, present in hand running"
5972170806979989411.webm,"eat eat eat eat eat, yummy, eat, eat up, cartoon eating, girl eating, hungry"
5972193694860710794.webm,"binge eating, stress eating, eating on bed, poor, eat rice, rice and egg, chibi, broke"
5972284327260588414.png,"EAT THE DIP, eat pizza, babydoge, eat the dip, baby doge"
5974187517463759825.png,"doge, doge heart, happy, heart, â¤ï¸, give heart, send love, dogecoin, sending love"
5974261962131901087.gif,"hehehee, sneaky laughter, you dont know, dont tell you, hiding from the truth, giggle, giggling duck, suspicious laugh, duck heheheh, hands on lips, huehue, hehe, duck, giggling"
5974385150383886758.webm,goth gif
5981293304631790248.gif,"caterpillar move away, hiding, hide, cat moving across the floor, Slowly crawls away, Haissss, Donâ€™t look at me, Iâ€™m leaving this place"
5985524770836320062.webm,"derp face child, nonchalent, dont know what to say, speechless"
5985741675274703134.webm,"get it awayy, eyes with tears, green hair anime"
5992460172356750365.webm,"omgg, awestruck, shining eyes, sparkly eyes, wahhhhh, Diamond eyes, Covers mouth, Blushing"
5996599923829639470.png,"buy!, purchase it!, ä¹°ï¼, just buy only!, purchase, just purchase it!"
5999165891911094071.png,"sweating, sweat down my face, i cant believe this, no way, nervous, oh no, sweat, anime guy sweating"
5999219660606672937.png,"wa not bad, awesome, swanky ah"
5999301763201503283.webm,"lol, lmao, toothless man laughing, roar, open eyes roar fail, toothless man"
6001156815411221762.webm,"anime girl, dancing, stars, gawd damn, sunglass"
6001401654316895893.png,"facepalm, i give up on this, thats it, finished, toji, exasperated, Oh my god, What are you doing, Hold head, Guy holding phone"
6001572276187695369.gif,"Frog, Angry, Fire, FROG RIOT, TORCHES OUT, FIGHT, ANGRY"
6008119447024306497.gif,"Shake legs, Do nothing, å‘å‘†, Cat, chilling, swinging legs, leaning back relaxing, cat bear, :3, leaning back look at sky"
6008122006824815192.png,"hehe, cute, :D, tiger teeth smile, yay, happy"
6017056805815849715.png,"UwU, worship, cut anime character, little girl, amazed, impressed, mesmerized, happy, daydreaming"
6021546734562314627.png,"holding in laughter, Humpf!, Angry, Girl"
6021762921741160222.webm,"HEEHEEHHE, big smile, how about that?, how bout that?, is that ok?, what do you think?, face moving to the side, blonde girl"
6024013278445832945.png,"beaver pepe, finger gun, Got it, Thats you, Point at you, Squirrel"
6025901998904185605.webm,life is unfair
6026226956129801290.webm,"teehee, smug smile, blue hair anime smile, Blue hair, Smiling, Hehehehhe"
6028510268118535109.png,"cry, tear, pajama, missing you, act sad"
6030813921072386855.gif,"bunny lay on table, bunny rub table, bunny waiting, Lie down, Draw circle, Bunny, daydreaming, :3, ahhhh, thinking, å‘å‘†, im wondering, wipe table with hand, lying on table, laying head one table, waiting, smushed face on table"
6032801657706777106.gif,"bouncing side to side, yes yes, agree, that's right, you got it, Heart, Bunny hopping, Happy happy happy, Arms swinging, Bouncing"
6033088509982542222.png,"botak, no hair, weird person, misaligned eyes, freak, no brain, Deformed"
6034983161790729959.webm,"sad, crying, crying baby, sed, sadge"
6037184615997770340.webm,"crying, black guy, sad, sadness"
6037291981590236826.webm,"hug, awww, couple, Hugs, Happy hugs, Best friend, Awwwww"
6039668653283084933.gif,"dark, pepe, shocked, shook, Nani!, How can you, Shocked, Very shocked, Is this what i see, ?"
6041608556866701908.webm,"å“‡å•Š, throw tantrum, æ’’å¨‡, yadayada, kitty on the ground, rolling on the ground"
6041897724129839930.webm,"hehehe, chilling, pitty pat, hitting leg on floor, relax, chill, sofa, relaxed, oops, paddle paddle"
6041915750107580802.webm,"heart, rabbit, ahhh, relieved, drink"
6046226823530941304.webm,paste my face
6046452773170449406.webm,"puff, smoke, i am the captain now, boss, smoking, anime guy smoking, pirate, eye patch, suit, noir anime"
6046468071843957434.webm,"shifty eyes, bunny tooh girl, ERRRRRRR, uncertain, hesitation, blonde girl eyes shifty, bucktooth, ERMMM, emmmm, i guess?, idk, im not sure"
6046560422230756258.webm,"jumping down the stairs, jumping downwards, i guess its like this, no only choice, jump down the building, commit suicide"
6048426860398775774.png,"lelelele, Come, I bring you go, Let me advice you"
6048607012802008304.png,"i gotcha vro, don't worry, i will help you, you are my friend, good friendship, panda and cat, buddy, i gotcha back, i gotcha bro, together"
6048747982218594945.webm,"ahhhh, screaming, omggggg, unbelievable, ahhhhh, baby screaming, scream"
6050902548267665981.webm,"beat you, hmph, angry, whack you"
6057708765761765997.png,"feeling down, sed, sad, feeling sad, upset, nawww, :(, liddat lol, sad baby, dissappointed baby"
6057819481428722699.png,"noob, skill issue, solo, lonemliness, sad, alone, lonely dog, sad dog, loneliness, dog in empty room"
6057821100631393327.png,"dont look, censored, cover eyes, dont let you see, hiding it from you, hidden in the dark"
6059824861788767346.webm,"hahahahahaha, shaking from laughing, lmao, lmfao, lol, hahahhah, crazy laughter, maniac laughter, sheep maniac laughter"
6060064495194079781.png,"yes sir, good bye sir, salute, respect, respect anime, black hair anime"
6060111593805451463.png,"into the galaxy, i feel great, AWESOMEEE, im done, all done, hands stretched out, expansion, powerful, universe, day dreaming, sky diving, falling, anime girl falling from sky, angel"
6062238757963171042.webm,"lying down sheep, machine gun limbs, frustrated sheep, sheep laying on the ground"
6064193689637357163.png,"eh?, looking up, white hair, dumb, staring up, OuO"
6064436368174484743.png,"point, wink, finger gun, winky face, pointing, finger guns"
6066520329256174997.png,"thank you guys, gg guys, you are funny, look at you, politician smiling at you, haha, lee hsien loong, gotcha, get it haha, LHL, singapore"
6066597217760710245.png,"drink bubble tea, sip sip, nom nom, drinking bubble tea, mkay, ok, alright, White hair girl, Cute girl, Drinking"
6066734858577645063.png,"looking outside the window, how about you?, you?, wbu?, looking out the window, peeking outside, peeking, curious, hbu?"
6068638830464861214.gif,"i want to be rich, feel poor, sad, dog, envy, jealous"
6068965398303212506.png,"sudden realisation, shocked, the moment of realisation, stunned"
6070890428415086049.webm,"afraid, fear, see you next time, shiver, cry, sad, so sad, sad max"
6070992382348758344.webm,"afraid, nervous, waddle waddle, shake tail"
6073177051823605012.webm,"suffering, capoo, bug cat, sad, heart pain, spotlight heart pain"
6073242167822780884.webm,"joke, reprimanding, eating, lying down, poor, nom nom, don't know what to do, lost, none of my business"
6073457710756529302.webm,"Huh!, Shock, What you mean, Nani!, Cannot be!, Mouth open big big, Eye stare big"
6075473042555798431.png,"lel, puppy orange shirt, :3, lelelel"
6075721699687400162.png,"HELP, HEADACHE, frustrated dog, paws on the face, oh no dog"
6077709861523556561.webm,"crying fox, stsars, cover mouth, Thank you very much, Teary eyes"
6077908250357925897.webm,"throw flowers, fox, basket, send gift, send love"
6080144047123465983.webm,"yes please, please, begging, angry screaming, sadge, big eyes, so sad, sparkles, help"
6080209846022440000.webm,"aaaaa, wadaaaaaa!, turn around, cat turn around, å•Šå•Šå•Š, help, help no, afraid"
6080249269527250394.png,"thumbs up, gud, clown good, simple good, no problem, good, clown look, not happy face, good for you"
6080264688459843547.webm,"looking up into the sky, how, æ€Žä¹ˆåŠž, how now, worried, scared, why like this, lost, exasperated, depressed, looking up at the sky"
6082388820370653725.png,"korea baby, pen tugging skin, confused, are you sure, mmmh, korean baby, crayon on face baby, wtf"
6084627357325330954.png,"fat cat sleeping, sleeping cat, tired cat, tired, dead, giving up, giving up on life, fat cat, give up"
608645201405149638.png,"giggle, female emoji laugh, lol, lmao, diva, diva nails, hahahaha, yoohoo, hands over mouth, sassy laugh"
6086663639975071575.png,"shifty eyes, copium, hopeful, delulu, Anya, Penguin hooding, Hehe"
6086758657536558832.webm,"disgusted, controlling, holding it in, cat, fa dou, æ‰‹åœ¨æŠ–"
6086763278921371064.png,"boom, yay, happy!, hands in the air, amazing, chika boom, win, im the best, best, victory, chibi explosion"
6086783452382757374.png,"hehehe, emotionless smile, :), c:, :>, :|, :D, HEHEHEHEE, stupid smile, dumb smile"
6087079594672785278.png,"give you clover, lucky lucky, yay, happy, four leaf clover, grey cat, happy cat"
6089052878742227568.png,"dog, clown, tom and jerry, cat, animated, jasmine"
6091277023261492067.png,"eeeeeeeeeeee, clutch teeth, uhhhhhhh, UHHHH, /__\, are you for real, no way bah, seriously ah, can like that?, UHHHHHHH, ERRRRR, UMMMM, hesitation, uncertain"
6091451145530639114.png,"shifty eyes, BIG eyes, staring, startled face, shocked face, eyes shifty zoomed in, let me SEE, see see, let me take a look, examine it, eyes big magnified"
6091510437554160426.png,"SIMP, simp, simp alert, look there's a simp, simp simp, holding simp banner"
6093511046205542394.webm,"yay, that's awesome, hand hitting head, amazing!, im glad"
6093709825881933338.png,"thank god, zen, feel chill, yay, hands together, pray, wishing upon the stars"
6097967710430302298.png,"are you sure?, uncertain, mmmh, think again, master, anime character, boss, anime character with stick, senpai, blue hair guy, crush, crush anime character"
6100327417002333017.webm,"woohoo, wooo, dance"
6102671073281577979.png,"facepalm, stupid, dumb, face palm, meercat face palm, upset, what to do, headache, annoyed, frustrated"
6102760163788195091.webm,"dance, shaking, whoosh, tipsy, playful"
6102777021534832677.webm,"tsk, annoyed to happy, ooo really?, change face to happy, korean baby, forced, stupid question, hehe, please, lil baby smile"
6104704654396883598.png,"cry laugh die me, wahahahaha, omg, crazy, hahaha"
6109149984202949786.webm,"what are you talking about?, give proof, goodness gracious, give me, tell me, how now, hands out, tell you already right, told you so, explaining something"
6109503623220168570.webm,"ok ok fine, headache, kid grabbing head, crashing out, its too much, just a baby, stop, :(, confuse"
6111478075520716393.png,"damn, wow, hmm, thinking"
6113917075778963883.png,"Hearts, many hearts, give hearts, â¤ï¸, ðŸ–¤"
6118153043109216900.png,"really?, hontoni?, really!?, surprised, encouraged, enthusiastic girl, cute anime girl, happy, excited"
6118661790575363073.png,"hmph, im upset, urgh, oh no, angry, pegro"
6120476126495113739.png,"hearts, gambatte, yay!, happy, nice smile, fluttery hearts"
6122752265888468341.png,"map, singapore, grid, singapore map"
6134034513614865094.png,"silly, orange dino, pokemon, stupid, head empty, dumb pokemon, ditto pokemon, O.O, charizard, stupid pokemon"
6134419243900343437.png,"blushing man, awkward, shy"
6136523876659628795.png,"awkward, nervous smile, awkward smile, sweat on face, anime awkward smile, nervous, sweat, nervous laugh"
6136529017735480014.png,"shocked, stun, amazed, wow!, !!, didnt know that, wow, amaze, much amaze much wonder, rly, really, seriously"
6138535733830353637.png,"ggwp!, ggwp, good game"
6138624347595607204.png,"explosives, bombs, looking from afar, look what has happened, explosives afar, explosion, far, far away, from a distance"
6138673207143563979.png,"isit?, questioning, doubting pikachu, izzit?, are u sure?, sure not"
6138710848236946133.png,"cheeky, bad, evil, paiseh, oops, sorry, mybad"
6140840241482696052.webm,"nai long, super saiyan, levitate, blocks, raged yellow dino, angry dino, furious, power up, powerrrrrrrrr, anti-gravity rocks, power, raise from the ashes, im powerful, fight you"
6141038905194972418.webm,"emotionless, nonchalence, nai long, nai long pleasant, nai long sitting on desk, nai long behaving well, well behaved, im nice"
6141056016344680899.png,"zzzz, my spirit has left me, souless, ä¸‰æ¡çº¿, im ded, ded, Diao, 3 lines, Facing down, Defeated, Sweating"
6141144862038164537.webm,"nailong nom nom, thinking, nom nom, munching, nai long eating, nai long, chewing, eating something, listening to gossip, hungry, i wanna eat"
614222774784754201.png,"square emoji, emoji with corners, soulless, Emoji, Joker smile, Diamond eyes"
614222774784754205.png,"o, oh, straight oh, is it, unbelievable, triangle oh face, Ghost face, Bowling ball face, Oooooo"
614222774784754216.png,"square emoji zzz, square emoji sleepy, time to sleep, Sleeping face, Zzzzz"
614222774784754255.png,"square emoji, how???, how?!, how, hands covering mouth, Oh no!, æ¥äº†, Covers mouth, Ooopsie"
6142968608231262949.png,"Laugh out loud, LOL, HAHAHA, lol, smiley, crying laughing"
6143079126329722230.webm,"corgi, heh, See again, Stare, Look closely, Shiba inu"
6143113309974433381.png,"gun to the floor, looking up, whatever, leave me alone, i am the most important, lai, one more time, shoot, gun, break into your house, man, muscle man"
6143147927410837887.png,"sipping tea, drinking tea, blowing smoke from tea, blowing tea, blow tea, waiting, chilling, chibi looking down drink tea"
6143179525485233903.webm,"confused, in a mess, messy af, what is going on, chaotic, korean baby"
6143221332696895762.png,"devil, monster, monster in the sky, devil appearing, angry, furious, appearing out of the dark, shadow"
6143324862883562902.png,"hiding behind desk, uh oh, oh no, guilty, hands on desk crotching, sad, hiding under table, shy"
6145294612194923358.png,"cool man looking downwards, looking down, at peace, cool, sway"
6145608479814976070.png,"dumb pokemon, empty brain pokemon, dumb squirtle, dumb blue frog, Squirtle ditto"
6145640855278455717.png,"confused asf, what???, ???, nani?, huh?, sweating, cold sweat"
6147422364763161168.png,"chubby girl, curtain, hehe, big chubby cheeks, cute fat girl, cute baby"
6150010383206711993.png,"burst into tears, bursting into tears, tears water the plants, crotched over crying"
6150028976120140272.png,"two knives, stone blades, two kinves, low-quality image"
615038311764852774.png,"charizard, charizard spitting fire, fire pokemon, ditto charizard, charizard shooting fire, dumb pokemon, dumb charizard"
6154406750385603257.png,"hello~, hello!, hey there, yawn, hug, hi, smiling"
6154476079747697214.png,"munching!, excited to eat, happy to eat, big eyes, nom, super hungry, nommmmmm, eating, munching"
6154486361899403030.webm,"nice to meet you~, hello!, nice to meet you :), agree, cat, shake hands, shaking hands, nice to meet you, hello, its good to meet you, Nice to meet you, Holding hand with cat, White cute cat"
6158696834303790838.webm,"dancing, lol, chibi manga blue dance, robotic movement, ugly dance, Hehe, Dancing, Blue hat character, Happy"
6158759497876638092.webm,"smacking little paw hands, you got this, you got it, punching little paw hands, Fist bump, Punch punch punch, Cuteness 100%, Damage 0%, Trying my best"
6158760752007088283.png,"Machine, Angry face, Blue robot, Robot with teeth, robot, angry, square, blue eyes, not good"
6158779984870640180.webm,"Hiding in one corner, Small, Cat, Sad"
6158808464798779816.webm,"rarrrrrrrrrrr, evil cat, evil disco cat, evil toothless disco cat"
6158907725787955783.png,"magnified face, what??!!!!, crazy what, big eyes what"
6159008047634055674.png,"eheheheheh, hehehe, yay, eyes like diamond, UwU, happy"
6159025184553568559.webm,"set cat on fire, cat on fire, its fine, cat, fire, all's g"
6159050451846169297.png,"cat laughing big mouth, cartoon cat laughing, lmao, lol, rofl, mouth open wide, mouth open BIG, :O, give it to me, put it in my mouth, WAHAHAHAH"
6159120090445908811.webm,"cat eating treat, cat licking treat, åƒè¯, Snack is medicine, Lick lick lick, Eat eat, Yum yum"
6159220794544099066.webm,"so sad, feel sorry for you, nawww, sad, cat sad, feels bad, Cat, Sad eyes, You see, å¯æ€œæ˜¯æˆ‘, Boohoo, Sob sob"
6160966823303972842.webm,"not jealous at all, sacarsm, grrrrr, dont make me whack you, :<, face turning angry, confused and angry"
6161033988002549131.webm,"sad, weepy cat, sob cat, teary golden cat, Cries, How, Despair, Cat"
6161200332085922416.png,"backache, just wake up, cat ears girl"
6163215547921073879.webm,"HAPPY NEW YEAR, happy new year, dancing, 80s, hny, hny!"
6163291968274171400.png,"vomit, bleh"
6167826616220126476.png,"just me, hehe"
6172231599103412141.webm,"whats going on, looking suspicious, cat zooming in, Huh!, You call me?, Turns head, Cat look at you"
6172607344317301847.png,"sleepy, sleeping, zzz, good night, goodnight, zzzz, in bed, zzZZZZ"
6176811249716695206.png,"deadpan, speechless, straight face, bald straight face, eyes staring into soul"
6181321983284742223.png,"oriental, haiya, purple bird, purple bird with fan oriental, oriental fan bird, purple fan bird"
6181362686689805749.webm,"aiya!, why my life so hard, zzz, cant believe this, annoyed max, frustrated, angry, no no no no no, throw tantrum, life is so hard, my life is hard, :(, upset"
6181642538168878267.webm,"angry, what nonsense, nonsense, mad, im so angry"
6183817771600579939.png,"grahhh, green monster, tongue out, BLUEEEEHHH, crocs, brains out tongue out"
6185723474359617068.webm,"nailong, belly dancing, boing boing"
6185733709266684730.png,"rock dinosaur, stoic, orange brown dinosaur creature"
