sticker_id,labeled_queries
5370833496723964185.png,"cool character looking side ways, staring into the void, anime cool character staring, staring to the side"
5377329467255439166.png,"boba eyes hamster, boba eyes ray, tearing, upset, sobz, sobs, cry, Rat, Crying, Big eyes, Tears"
5379585312928304150.png,"walking out the door, bye, im leaving, bye bye, Leaving this place"
5379593958697479994.png,"drink tea, judging, drinking coffee, feeling cool, cool eye, model eyes"
5380097672461956696.png,"urghhh, so bored, nothing exciting, startled, boring, Bored, Hais, Do what know"
5381999320771872196.png,"kill you, knife, boba eyes hamster, boba eyes rat, Knife, Animal, Big eyes"
5382074469814635172.png,"heart broken, Heartbreak, Tears rolling, Lying down"
5382188213433535803.png,"ooo?, really?, hands covering mouth, ophs, hehe, my bad, hand to mouth, fake gasp"
5382284510895299967.png,"hmmm, skeptic"
5384608625073334226.webm,"sad cat, emo cat, cat laying on bed, mmmm, cat laid down, loaf, loafer, loafing, bread loaf, cute, ._."
5386496297559672014.webm,"michael jackson dance, dancing, hand behind head dance, hand behind head, cool"
5388600728455496387.png,"pwettiee pleasee, crying cat, crying, eyes with tears"
5390869570699401064.png,"tearing, hand over mouth, Tears, Crying, Hand cover mouth, é£˜èµ°, åŽŸæ¥æˆ‘ä»€ä¹ˆ, éƒ½ä¸æ˜¯"
5391177180552106514.png,"sianz, zzz, question mark, NANI, send help"
5395710638792132506.webm,"dance horribly, idiotic dance, terrible dancing, terrible ship dancing, im so bad at this"
5397603306325425879.webm,"upset, angry, pegro, zzz, dulan, frustrated, annoyed, irritated"
5397687938655992993.webm,"sad, don't go, Cries, Want to try, But decide not to, Tears"
5397698491390638939.webm,"so in love, in love, mua, so happy, blissful, cupping face, dazzled, amazed, wonderful, luster"
5397833194449931612.png,"cry laugh, eyes like eyes, cry laugh die me, smiling and crying, eyes like eggs, AHHAHAHHAAHA, laugh till i cry"
5397922070208200185.webm,"WAAAOw, EYES BIG, puppy eye, jasmine"
5397934564268065129.webm,"infuriated, self control, resist, control myself, extremely annoyed, shivering from anger, cover mouth shaking in anger"
5399880717029089076.webm,"cat blink eyes big, mmh mmh, cat blinking, cat magnified, cat close to camera blinking"
5400086630646158284.png,"ah???, howww, ä¸‰æ¡çº¿, shocked, no soul, diaoooooo, three lines, I ^ I, -_-''', stunned, how did you know, im shocked"
5404427644286540616.gif,"trying to stop laughing, hehhe, hands covering mouth, try to not laugh, hehehe, snickering, hands on mouth, blushing boy, are you for real?, you're kidding right, try not to laugh, hands covering your mouth, trying not to laugh"
5407007274658960437.png,"..., æ— è¯­, speechless, waiting..., Waiting, Crow flying, Staring in despair, â€¦, Nothing to say"
5407124720539676485.png,"life is hard, carry burden, lots of burden, lifeless, burden, carry, carrying, ant angrying, carrying burdens"
5411438078885628349.png,"cries, sad, maid, headband, Maid, Small heart, Cries, Ugly emoji"
541175087705890617.png,"cry run, running cry, sad, wipe tears running, running while wiping tears, tears flying, yellow dinosaur"
541175087705890620.png,"hehehe, satisfied, yellow dinosaur satisfied, happy, :), Ok, Looking forward, Dinasour angel, Smile"
541175087705890624.png,"hi!, hi, welcome~, hello~, yellow dinosaur, hello, hands out, hello gesture, yellow dinosaur side ways hi"
541175087705890631.png,"Muhahaha, Too bad, Aha!, Haha, fanning myself, are you sure?, sure not?, doubt, spiteful, arrogance, looking down, look down on people"
541175087705890634.png,"uhhh, three lines, ä¸‰æ¡çº¿, oh no, oopsie, hand covering mouth, staring to the side, hesitation, hands covering mouth, uncertain, worried, anxious"
541175087705890645.png,"yesu!, fist clenched yes, >_<, yes!, got it!, heck yea, fist pump, XD, dragon XD face"
541175087705891783.png,"dodge, hit you in the face, smack you, whack you, fight, you whack me i dodge, dodged successfully, miss"
541175087705891784.png,"Snorlax, No effect, No effect!"
541175087705898939.png,"hehe, soft girl feels loved, happy soft girl black hoodie, Heart shape, Hands on chin, Eyes smiling"
541175087705898961.png,"tired about life, ç´¯, damn, tired girl"
541175087705900278.png,"palm tree pokemon, dumb pokemon, dumb tree, coconut tree, pokemon, eggsecutor, palm tree, egg"
541175087705900351.png,"bamboo, stick, panda, rope, palm tree trunk"
541175087705903954.png,"peekaboo, hiding, me too me too, i also want, i want, puppy eyes, whimper, cat in a box, delivery"
541175087705903995.png,"pat pat, thats good, good job, well done, comforting, its ok, its alright, dont worry about it"
5413385090640120944.gif,"OH YEAH, oh yeah, grooving, hell yeah, yes yes, thumbs up, bouncing thumbs up radish, thumbs up dance crazy radish"
5413665049493387814.webm,"dead, smoking, chill, smoke, blow air, cool, girl smoking, anime girl smoking, girl vibing, cyberpunk, cyberpunk chill girl smoking, blade runner"
5413697145783989344.gif,"dizzy, dizzy from penguin, seeing stars, huh???, what do you think?, im confused, æˆ‘æ™•äº†, Dizzy, Spinning"
5418158860890292859.webm,"yayy, clappin hands, happy for you, nice, clap, applause, great job"
5420121639469718659.webm,"dance, dancing, twirling, kimono dancing"
5420297801848334827.png,"looking, looking at the side, blush, hehe"
5420627745530983759.png,"omg, that's amazing, sparkles, fantastic, eyes big, happy for you, what a surprise, crown, Finally!, Diamonds, Crowned, Open mouth"
5425131113230116238.gif,"consoling myself, sayang myself, crying nonstop, solemn, laying pool of tears"
5429618477881104725.png,"aaaaaaaaaaaaaa, finallllyyy, aaaaag, aaaaaaaa, aaaaaaaaaa, frustration, anxiety, scream, shout, Aaa"
5433703039024249379.webm,"I control everything, task completed, boss, high achiever, anime boss, power up"
5434105267006475262.gif,"smh, blue bee smh, disappointed blue fly, disappointed bee"
5438104418429975563.webm,"can't hold excitement, love, omg, no way!, amazing!, hands covering mouth"
5440446687434778250.webm,"bangs moving, pink hair girl, Blink blink, å°å ‚å‘é»‘, Turning black"
5440460933841299887.webm,"wink, cute anime girl wink, Wink wink, You know i know, Hehehehehe"
5440500112532972502.webm,"all the best, eating, eating watermelon, nom nom, Eat watemelon, You got it!, Iâ€™m here to watch show, é ä½ äº†, åƒç“œ"
5442762409246729110.webm,"staring at rain, staring into the sky, sadness, rain, gloomy"
5442934676089999720.gif,"cry over wine, so sad, shitty luck, sad max, å€Ÿé…’æ¶ˆæ„, sad, drinking, wine, biver"
5447207455584962337.webm,"WAHAHAHAHAHHA, poof and laughing, look into sky and laugh, winner vibes, Thank god"
5451849821310693879.webm,"yay, satisfied, dirty face eating, so full, happy, feeling good, eat a lot happy, tummy full, yums, yummy meal"
5451857505007185450.gif,"ok, thumbs up, sweet!, kiss, mua~, eye brows raised"
5453986301252482012.webm,"hehehehe, cant stop laughing, try stop laugh fail, hahahhHAHAHAHHA, try not to laugh, gamer laughing, sarcastic laugh, lol, lmao, rofl, funny, youtuber laughing"
5454124504710136886.webm,"hello~, gentle hello, hands waving, Anime girl waving, Hi, Hello"
5454148444857835100.webm,"wandering, cat staring, mmmh, meow, cat, cat sitting down demure, cat guai"
5454268948755269027.png,"cool, Stares afar, Genshin, Handsome is me, Act cool"
5454378350162233008.png,"Who are you, side eye, tsk, annoyed, side eyes, chibi side eyes"
5456468495996820995.webm,"yesssssssss!!!!, yipeeeee!, amazing!!!!, tummy rolling, cat dancing with tummy out, oh yeah~, oh yea, belly shaking, cat dancing, bottom pov, omg so happy, finally"
5456543331506986617.webm,"oh no, hidden attack, attack from behind, ehhhhhh, dragged away cat, dragged away, suddenly dragged away, surprise attack, surprise attac, attack from the back"
5458446053558728885.webm,"macdonald cat, that's that, mmmh, :/, ðŸ˜•, McDonaldâ€™s cat"
5458475809092155697.webm,"doge, heheheh, smirking, corgi, you would i know, eyes squitting, hehheeh, smirky, smirk, you good you know that, nice, thank you, naisu, Corgi smiling, Smirk, Heheh, You know de"
5458573347799448951.webm,"kitten listening to music, listen to my jam, Come listen music, Hear the gossip, There there, Lai"
5458641088023641504.webm,"foodddd, hungryyyy, give me, time to eat, hello wheres my food, clanging food bowl, gimme food"
5458718040952684027.webm,"happy cat, jumping cat, happy happy happy"
5458720295810512567.webm,"whack cat, beat you, beating, beat, fight, cat paws hitting, whack, slap you, attack u, talk so much la, whack you now"
5458762214691322011.webm,"vibing pug, dancing pug, fat pug dancing, fat pug having good time, Iâ€™m ready, Leggo, Shake shake, Ready to jiggle, Dog dancing"
5458764585513270764.webm,"why, cat, pain, clutch head, whyyyyyyyyy, noooo, ahhhhh, paws covering ears, grey cat covering eyes, grey cat, oh no, regretful cat, Argh!, No!, Cannot!, Cat holding ear, Internally dying, Silent scream"
5458853461271525655.webm,"AHHHHHH, raising hands in the air, freakkkkk, omg i can't believe this, omg, zooming in, AAAAAAAHHHHHHHHHHHHHHHH, NOOOOO, NAAURRRRRRRRRRR, FML, BLACK CAT"
5460669313314724334.webm,"HEHEHEHEHE, munching chips, YESSS, so happy, oh yeah, thats awesome man, crazy man eating chips, hungry, tasty, yummy, gossip, spill the tea"
5460692424533757643.webm,"sniff sniff, whats up, smelling, Sniff sniff, Nose twitching, I sense something"
5460725719120221290.webm,"nom nom, chewing, lemon chewing, i demand it, orange chewing, orange with human face, fruit with human face, fruit chewing, yummy fruit"
5460925671322687118.webm,"yawn, tired, miao~, meow, cat mew, mewing cat"
5461096439222388600.webm,"headache, head on fire, hurt, got punched, baluku, head hurts, punched and head hurts, it hurts, hurts badly, painful, got beaten, hurts"
5461106128668604900.webm,"side eye, trying to peak, peeking, cat side view"
5461114808797502677.webm,"shaking tea cup, not sure what to do, smiling, fail to stay calm, trying to stay calm, control, control myself, shaking cup"
5461141669522969832.webm,"scurry away, run away, quickly run, hiding, bye bye, i go first, bai~, cat running away, cat scaping, ninja cat"
5461148584420316560.webm,"puppy eye, sad look cat, cat head back, puppy eyes cat, OuO, big eyes cat, wondering, thinking, considering, look at me, i want attention"
5463133013929892362.webm,"cat giving up, give up, tired, tired cat, go to sleep"
5463327077732205953.png,"scared for life, no way, can't do this, Sweats, X eyes, Stare downs"
5463377247245178537.webm,"this is mine, mine, cuddly cat, cuddling a cat, cuddle cat, rubbing cat, comforting cat, dont worry you got me, where's mine"
5463401917537338296.png,"swanky, im so cool, cool, cool hand sign, dread vibes, smug"
5465545351031172527.webm,"huh?, whats wrong?, why like that?, confused, ?, whaaat?, wonder, what anime girl, wonder anime"
5472006553802380397.webm,"chewing, waiting for a reply, anticipating, porcupine munching, porpupine eating, porcupine nomz"
563108579448455596.png,"shades down, are you for real, for real not, sus max, suspicious person identified, looking at you, Im watching you, Let me see properly"
5647518987899109387.gif,"URHGHHHHH, drag face down, URGHHHHH, adventuretime, pulling face down, unbelievable, unacceptable, shocked, GRRRRRR, frustrated, adventure time"
569118802063655903.gif,"pepe, laugh cry, HAHHAHA, HAHA, Laugh cry me"
569118802063656024.gif,"cry, pepe, tearing, sadness, crying face"
5699587456249102344.gif,"Thumbs up, Adventure time, jake and paul dog, dog give big thumbs up, big thumbs up!"
570116660405469295.png,"traumatized yellow ball, shocked, terrified"
575666406691967024.gif,"swishing tongue, blehlelelelel, lehlehlehleh, waddling tongue, lelelelelelle, lehlehlehlehleh, blehblehblehbleh"
575666406691967029.gif,"sad baobao, lying on the side sad, weep sad, curled up on side cry, grey, depressed, so sad, sad in one corner, sad, rolling on one side sad"
575666406691967033.gif,"cheer cheer, jiayou jiayou, jiayou, jyjy, jy, cheerleader, cheers, pom pom, hooray, yipee"
575666406691967034.gif,"farting, boot"
575666406691967047.gif,"scratch armpit, scratching chest, frustration, smile thru the pain"
575666406691967059.gif,"Hand together, Laughing laughing, :D, Hehe, Haha, happy bouncing bubble head, bubble head open mouth smile"
575666406691967069.gif,"thank you, arigatou, nodding in thanks, thanks, xiexie, Thank you, Lao ban heng heng"
575666406691967445.gif,"lazing around, chill, on sofa, lying down, relax, resting"
575666406691967452.gif,"nom nom, eating chips, see show, snacking, watching show, cat eating chips, cat snacking, cat watching drama"
575666406691967458.gif,"nom nom, çœ‹æˆ, eat pokemon, see show, eating popcorn, chill relax, lying on sofa, munching"
576081150208901458.png,"i beg of you, please please please, life is hard, step step, please please, this is so hard, lyfe is hard"
576081150208902864.png,"mmmmmmmmhhhh, straight smile, awkward smile, cat awkward smile, uhhhhhhh, hesitation, shocked cat, cat in disbelief, cat with weird face"
576081150208902926.png,"why like this, send help, spiky teeth, NOMZ, scary mouth"
5764673038465371725.webm,"anya salute, look afar, looking at the far, look far, seeing far, far, anya, hands on forehead, Anya, Looking up, Cute girl, Woahhh"
5764709378183664220.webm,"cry, tears, baby, baby sad face"
5764841285219260500.gif,"why me, pepe cry sad, raising hands pepe, raising hands pepe cry, what to do, im so lost, cry die me, in despair, lost, helpless, depressed, pepe frog, peepo, surrender"
5764919707027115028.png,"smirking, hehehehe, haha, hehehe, side eyes"
5764969210820169448.png,"drinking boba, drinking, anime drinking, spectator, interesting"
5764995826732502700.webm,"heheheh, spy family, evil smile, muahahahah, you can't guess it, iykyk, shifty eyes, sus smile, anya, heheheheh"
5767102271967989613.png,"kowalski, taking notes, reality check, what the heck, so done with life, unclear"
5767276252503215601.webm,"smoking, chill, lit a cigarette, lit a ciggarette, let me listen to this, so chill, so cool"
5771429026316946249.webm,"point of no return, no other solution, only can like this, meme, æ²¡æ•‘äº†, gg.com"
5771621569700827976.webm,"suddenly thought of it, sudden, got it!, no wonder, i guess thats why!, no wonder!!, thinking, i got it!, it came to me suddenly, lightbulb moment"
5773875877775411911.webm,"excited, super excited, jumping around, cat jumping, wow yay, so excited!!, excites!!!, much excited, cat disco, jumping, yipeee, jumpy, hooray, so excited"
5773950464177474520.webm,"make me angry ah, im angry now, angry, happy become angry, become angry, you make me angry, squishy face, Make me angry"
5778208623603749670.webm,"å¸…, gojo being cool, yea what can i say, rub neck, gojo, wiping hands on neck, just saying, you know im cool, im cool like that, swanky, confident, oh yeah, im so cool, im so pro, gojo satoru, shades cool man, wipe neck cool, flex"
5778383067995443756.webm,"ok ok yes its me, ä¹–ä¹–åä¸‹, getting pointed at, gojo being pointed at, simimasen, become guai"
577913907243385218.png,"smiling face, yay, happy, hahaha, smiley face"
5780456523587129501.png,"angel, hehe i'm so nice, anime girl with halo, Angel, Anime, Halo above, Angel singing background music"
5780613105209839806.webm,"wipe face, baby wiping face"
5780745141094453160.webm,"good bye, bye bye, i am leaving, bye chat, jumping down from building, Goodbye!, Falls off bulding, Exits gracefully"
5780782030568559122.png,"just woke up, bruh, are u fr, messy hair, frustrated, annoyed, tsk, staring up annoyed"
5782720353604209195.webm,"hurhhh, cat, wot, look down, not meh"
5782807927987376193.webm,"nom nom nom, chewing, Porcupine eating, porcupine chewing, munching, very delicious, very tasty, delicious"
5783008460010427093.png,"crying, å´©æºƒ, sobbing crying throwing up, anime girl crying, :(, pink hair, cries"
5784894547653824381.png,"bulging eyes, WAAAAA, HURHHH?, one drop of sweat, shocked, eye big big"
5789818439895880677.webm,"drink beer, stealth drink beer, sippy sippy, :p, slipping away, chill, chihuahua take beer across"
5791831886204505987.webm,"thinking, baby, hehehe, hmph, let me think about that, hands to waist, baby hands to waist"
5792049065520794365.gif,"scurrying away, hurry away, walking backwards, run away, not me, whot?"
5793919102871409797.webm,"guitar chill green, chill monster playing guitar, good vibes, jamming, golden hour, blessed, chill, chilling, chill music, happy monster, Playing guitar, Happy, Light green animal, Yeahhhh"
5798450125864962790.png,"pepe, taking notes, serious, Taking notes"
5798532275704433080.png,"hehehehe, evil, gossip, Evil, Deveil, Ugly"
5801038449251190947.png,"smirk, snope dog, side eye smile"
5803327645345122600.png,"old man, dont test me, bow arrow, Old man, Shooting arrow"
5805196810817375697.webm,"party, disco, yeaaaa, cats, Disco dancing"
5805197489422209987.png,"æ¥å§, Welcome in"
5809799014303927378.png,":), smiley face, polite smile, nice smile, gentle smile, genshin, blonde hair, smiling chibi, c:, :D"
5810135241523728131.png,"blur, poker face, honest, chibi honest looking, im honest, this is the truth, innocent face, believe me"
5810139162828870050.png,"heheheh, UwU, enen, gentle smile, if you know you know"
5812282879790553101.png,"too much stuff, weight, Too much on me, Big hat small body"
5812316810032188260.png,"omg, i cant believe this, this is amazing, wow, bursting from excitement, !!!!, !, Ohmoooooo, å´‡æ‹œ, Hands covering mouth, Diamond eyes, Cannot believe it"
5816832302424004647.png,"guilty, looking down, sowwie, im sorry, i wanna confess, Im sad, Teary eyes, Sad face, Feeling down"
5816937851245301286.png,"Lol, Sorry i stupid, Ahahahaha, Ignore my stupidness, Thank you, Hehe, White rabbit"
5821421762742587183.png,"hi, smiley face, å¾®ç¬‘, gentle smile, heart, Heart shape, Eyes smiling, Mouth open, Girl"
5823495132434926545.webm,"relax, chill, zen, laying on the floor, mmmh, tired beat, laying on the floor resting, so exhausted, fatigue max, shag"
5825492498385998298.png,"bruh, æ— è¯­, staring into the void, staring at nothing, poker face, expressionless, emotionless"
5825925405319631300.webm,"shrug, hehe, idk man, black and grey"
5825967994215339973.webm,"sad face, spy family, eyes like eggs, i need to do this, sad, crying, sobbing, cried, HURRRRR, please, anya"
5828178506508406526.png,"chilling on crib, anime guy on crib, too old for this shit, Lying, Staring, Blue hair guy"
5830082929367190544.png,"shocked, nervous, omg, what is going on, startled, shocked cat, o.o cat face, what??"
5830286347608263785.gif,"huh, taken aback, are you for real?, for real?, seriously?, huhh, bubble head taken aback, raised eyebrow"
5834575963375013544.png,"jesus, Jesus"
5836732294655642795.gif,"make myself smile, eh eh?, bubble head, HEHE, BIG SMILE, CHUBS"
5836790306778910167.webm,"ghosting, apple, Ghost, Cutting apple"
5836935807385996902.webm,"drink beer, nomz, eat watermelon, listening to gossip, listen gossip, delicious, sedap"
5841543255027617154.png,"crashing out, tweaking, black kid tweaking out, Cries"
5843468087570994864.webm,"vanishing, show us, appear and disappear, quickly, suddenly appear, appear and reapply, teleport, teleportation, shuttering"
5843608648965690240.webm,"cool character looking sideways, gif, cool character gif, side eye, camera angle moving, The Knave, mmmmh, anime character"
5843952607126621889.png,"hehe, master, boss, lit eyes, purple eyes, cartoon girl, anime girl boss, power up, powerful girl, looking down, staring down, scary glare"
5845876563496668653.png,"drink tea, sipping tea, suit man sipping tea, mmh, handsome guy, Drinking, With gloves"
5847974002185737103.png,"hmph, you think i dont know, let me guess, >:), pretty woman scheming, scheming, thinking, lookback, look back"
5850627557535258354.png,"oops, not today, not my lucky day, uh oh, Penguin, Not your day"
5852464588062199730.webm,"hiding, rabbit, omg, zai, peekaboo"
5852497380137505010.webm,"+1, me too, me also, spam +1, agree"
5852535798619967432.webm,"clap hands clap hands, no no no, nonononno, go away"
5852558123859972313.webm,"sad, alone, tears, left out, wipe tears, so sad, :(, feeling sad, lonely im so lonely, lonely, sed"
5852610449446540005.webm,"Silent, Cute rabbit, Grey rabbit, whispering, i know someone"
5852718192996126562.png,"autumn girl smiling, smile, welcome, welcome â¤ï¸, you're welcome, side way smile, happy"
5852747570572431294.webm,"sliding, smooth, scooter bunny, otw, les get it"
5852749413113401777.webm,"pew pew pew, splash water, fighting, pew pew"
5852767194278006492.webm,"traveling, finding, rowing, bunny, duck float, coming to find you, otw, on the way, rowing boat"
5852781784281910879.webm,"wave, sad bunny, beach, crying, washed, washed by the ocean, i cri, y u do dis, attacked"
5852829063281906096.webm,"want to faint, soul leaving body, dead but happy, die happily"
5852839306778905989.webm,":(, send help, standing in the rain, in the rain, sad, feeling down, upset"
5852864054380465145.webm,"peng, kanpai, cheers, congratulations!, congrats, gratz, yipee!, cheers!, rabbit kanpai"
5852888995255553464.webm,"i block, shoo, block your attack, block you attac"
5852905767102844754.webm,"sneeze bunny, achoo, bunny, sneeze"
5854716692818561417.gif,"smack face on table, face table, go away, slam head on table, so done, cat being done"
5854781082968265235.webm,"thats you, gotta be you, finger gun, finger pointing at you, hey whats up, eureka, you got it, bingo, pointing finger, wise woman, elderly, correct"
5854800865587630308.webm,"Hi bro, wear your glasses, so tired, wear shades, fatigue"
5854898052107602741.gif,"laughing pepe, cover mouth, ggiggling, Ehehehehehhe"
5854931419708527421.webm,"thinking cat, zoom in cat face"
5855039412366217922.webm,"Happy, happy racoon, dancing racoon, rotating and dancing"
5856979925835190359.webm,"shoot up, grow up, small to big, doink"
5857409860651452966.gif,"side eyes, hehehe, cat ears moving, side-eye cat, wiggling ears, self-satisfied cat"
5859302364975991253.gif,"pepe laugh tears, heheheheh, pepe zooming in, pepe tears of laughter, pepe zoom in zoom out, pepe cry laugh, pepe cry laugh die me"
5859484179531567872.png,"noot, girl, oh my god, OMG"
5859629478275188680.gif,"WAHAHAHAHA, laugh cry die me, pepe laugh show teeth, haha, smiling frog"
5859685944210230134.gif,"coffee, interrogate, pepe, hmm, Drink coffee"
5861438415421051762.png,"noot noot, penguin, sandwich, Penguin, Sandwich, Shouting, Can you hear me?"
5861775544583980877.gif,"heheheheheh, >u<, laughing, wahahahha, throw back head laughing, cute cat bear"
5861952746344682376.png,"shoot, guin, penguin, NOOOOT, Piu piu piu"
5863706381491637968.png,"hide, shy"
5863805668250619689.webm,"angel, look up to the sky, morning, ohaiyou gozaimasu, look up, Greeting, greeting anime, bowing, bowing anime"
5864104271556906185.gif,"nom nom, minding my own business, eating, crying, eat grass, eat dirt, sobs sobs"
5866056304128168292.png,"duly noted, noot, Got it"
586607011244802278.png,"look at me, silly, pink blob, pink ball, pink ball to the side"
5866480741386293865.png,"suited, noot, penguins, Ok got the task"
586949487642018135.png,"carry plox, roll eye, smiling, guai smile"
5870474025884455008.webm,"celebrate, dog, cheerleader, pom pom, Cheerleader"
5870571397088022977.png,"noot noot, Noot Noot"
5870577599020797507.webm,"bow, sympathise, doggo, thank you for your service"
5870915767565814849.gif,"raise eyebrown, genshin, tea cup"
5872754361460855082.webm,"calm, boss style, chill guy, drinking coffee, drinking tea"
5872853171478466935.png,"death smile, :)"
5873039955311202770.png,"here you go, this is the solution, solution to the problem, here, take this, take from my hand, only way, Lai, Give you, Tada, Na"
5873240040657653410.png,"gunpoint, dead eyes, Shinei nouzen"
5875303828277955411.gif,"sigh, feeling down, draw circle with stick, draw circle, dont know what to do, mmmh, drawing circle on floor, sad, lost, clueless"
5875321128406225421.webm,"party, dancing on the horse, so excited, excited for this!, can't wait!, lets do this, oh yeah, grassland dancing on horse, dancing on horse, dance, celebrate, dancing outdoor"
5875388877220351228.gif,"Pokeball bag, Crying, Tears in eyes, å¥½å§.., Boohoo, wuwuwuwuw, how can you do that, im so disappointed in you, whimpering, quivering, teary eyes, å§”å±ˆ, ðŸ¥¹, bald boy pokemon"
5877707339221438501.png,"dynamite, batman?, noot ???"
5881881686655897918.png,"stun, didnt want to say but, shocked cat, motion effect, cat on shoulder"
5886303660429806412.webm,"laughing baby, laugh, hahahahah, angry then happy, hahaha, LMAO, LOL, laughing"
5886520496148713233.png,"confused, what is going on, i m lost, me lost, dizzy, dizzy eyes, pink, Eyes dizzy, Diao, Mouth open, Eyes in spiral, Pink"
5890793511866862310.gif,"So sad, Tears coming down, Crying, Hold knees and cry, cry until eyes red, tears falling down my face, curled up hands over knees, so sad, im sad, :(, upset, sobs, sad max"
5891212022070119451.png,"you're welcome, give flowers, no worries, no problem!, flowers for you"
5892971219199726149.png,cool boss
5892986212930556325.webm,"facepalm, aiya, haiya, hide myself, embarrassed, ashamed, shy, nervous, paws covering face"
5893164806260659669.webm,"drinking coconut, swaying, party, drink coconut, rabbit bopping"
5893206673601862277.webm,"fight fight, battle, poke, poke you, stab you, klap you"
5893239826454417786.webm,"bunny, nodding, agree, enen, yes yes, i agree, that is correct, that is right, right, ofc, of course"
5893267679317332411.png,"rules, noot, meme, gc"
5893274499725397926.webm,"take my money, money bag, bunny, take my money!!!!!!!, take my loots"
