sticker_id,labeled_queries
1001242763158618196.png,"Thumbs up, Good job, thumbs up, good, very nice, stupid face thumbs up"
1006523975204864007.png,"wtf, shocked, thinking hard, mindblown, thinking very hard, let me think, thinking, thinking deeply, spiraling"
1011944004889085707.png,"go to bed, ermit the frog sleeps, puppet frog goes to bed, give up, Boring, Sleeping, On bed, With landed light"
1017943490086044330.png,"laugh laugh, laugh tears of joy, pikachu tears of joy, pickachu, laugh die, pokemon, funny, Unbelievable"
1017943490086044331.png,"ahhh, i want, crazy in love, madly in love, i want i want, ðŸ˜, thirsty, chasing after love, mad in love, pikachu mad in love"
1017943490086044334.png,"yipee!, pokemon running, going off!, on the way, yay!, so happy!, so excited!, running off, otw, lets do this, lets go"
1017943490086044335.png,"pikachu derp, biting jaw, over bite, derp face"
1017943490086044336.png,"yess!, oh yes hand, hands in fist yes, you got it, lets do it, naisu, pikachu, oh yeah, i got this, confident, i can do this, determined"
1017943490086044338.png,"hands over chest, hmph, thats me alright, confident, pikachu, cool pikachu, hands across chest, confident man, fierce pikachu, not scared"
1017943490086044339.png,"pikachu cry, left out"
1017943490086044340.png,"oh noooooo, yessss, hands in air but crying, nooooooo, pokemon, oh my godddd, Cry, Pokemon, Pikachu, Whyyy, Really sad"
1017943490086044341.png,"Arghhhhh, Time to show my power, Best attack, Angry, zzzzzz, strike you, thunder bolt from cheeks, scare you, go away, scurry, go, leave this place!, >:o"
1017943490086044342.png,"pokemon investigator, who is this?, whats this?, what this?, investigate, peeking, pikachu, detective pikachu, pikachu detective, i can see you"
1017943490086044343.png,"muahahahaha, evil pokemon laughter, C:, c:<, planning something, mischievous, wiping hands together, evil pikachu"
1017943490086044344.png,"Detective pikachu, investigator, investigate, let me take a look, let me see closer, are you sure, i will check you out, detective pikachu, detective"
1017943490086044345.png,"thumbs up in the air, pokemon smiling with eyes closed, thank you!, ear swaying to the side, Thumb up, Ok, Good, Nice, Pikachu"
1017943490086044346.png,"kiss kiss, heart, love you, hehhe, â¤ï¸"
1017943490086044347.png,"snarky, shifty eyes, ok sign, pikachu ok, ðŸ˜, ok, pokemon, detective, hat, confident"
1017943490086044348.png,"right?, :o, mouth open wide eyes big, pikachu, shocked pikachu face, shocked pikachu face cartoon version"
1017943490086044349.png,"nawww, i feel so bad, feeling down, feeling upset, nanguo, éš¾è¿‡, :(, upset, sad pikachu, down, ears drooping"
1017943490086044350.png,"pikachu, lightning, what??, huh?, no way!, heheheheehhe, up to no good, evil smile, mischevious smile, evil laughter, muahahahaha, >:3"
1017943490086044351.png,"Drink coffee, Pikachu, Need to ot, alcoholic detective pikachu, tired pikachu, tired detective pikachu holding cups"
1017943490086044352.png,"pikachu, lying down, pondering, sigh, Despair, What should i do, Lie down think"
1017943490086044354.png,"tearing face, blehhhhh, sticking out tongue, pikachu, making funny face, pulling face, pikachu making funny face, :p, whacky face"
1043703381077524694.png,"thumbs up bro, thumbs up doge, doge thumbs up, gud"
1043703381077524696.png,"hiding behind, peekabo, hehhee, big eyes, hello, peekaboo, its me, im here, did i hear something"
1043703381077524705.png,"smug, smirk, dog, side eye"
1043703381077524709.png,"throw up blood, vomit blood, coughing blood"
1043703381077524716.png,"begging, big eye, cute eye, dog, puppy eye, bling bling, puppy eyes, pleaase?, pleaseee, please, potential, maybe?, is it possible?, hopeful, really?"
1043703381077524727.png,"diu, toh, dog, sian, drawing in the sand, stick, sigh, hopeless, doggo no hope"
1043703381077524731.png,"urgh, this sucks, wait damn long, laying down, still waiting, sian, annoyed, so tired"
1043703381077524734.png,"sigh, showing back, back faced to us, hands behind back, doge sigh, hais"
1043703381077524737.png,"smoking, dog, corner, corner smoking, urgh, so done with life"
1043703381077524740.png,"picking nose, dog, digging nose, what do you mean"
1043703381077524802.png,"no fear, tired dog, dog on chair, exhausted dog on chair"
1052321353216032834.gif,"hahahaha, lmao, lmfao, lol, laugh out loud, cry laugh, ahahahahaa, unicorn laugh till cry, HA HA HA, HAHAHA"
105996717668698236.png,"thankful, happiness, excitement, shark, thank you!, thanks, good to know, happy, thank you, thank you~"
1102348238926643205.png,"spongebob dead eyes, grrrrr, bite lips, annoyed, frustrated, annoyance, spongebob, zzz, emotionless"
1111394900340899959.png,"fr?, show double chin, disbelief, no way real, for real?, whut?, whuttttt?, bubble head lean back, bubble head kneeling"
1126736944429007053.png,"hiding in the corner, shy, dont see me, hide, Want to be alone, Beside the wall, Cat, Only back"
1149383731455197345.png,"must be you, lets do it, this is the only way!, lets go!, lets go, pointing far, pointing to the abyss, go on, go go go"
1187021629381674816.png,"hmmm, HMMMM, thinking, let me think, hmm, ðŸ¤”"
1194073003609032120.png,"mantap, thumbs up face, you good, dumb thumbs up, man thumbs up, good, gud, thats good, dumb face thumbs up"
1196171713608417575.png,"heart, damn, amazing, wow, this is my heart, show you my heart"
1206811657565634869.gif,"pointing laughing, hahahahah, you're so funny, you're a loser, laughing at you, laughing, hahahaha, pointing at you and laughing, lololol, all laughing at you"
1220028319907447048.gif,"hahaha, lmao, teddy bear, falling down, rofl, damn funny, laughing uncontrollably"
1220028319907447335.gif,"laile, coming, wait for me, motorcycle, riding bike, weeee"
1220028319907447341.gif,"yay, happy happy, dancing pig, walking walking, happy"
1220028319907447342.gif,"fight, urgh, annoying, tackle, bickering, irritating, squabble"
1220028319907447445.gif,"hehehehe, laughing, cover mouth laughing, rabbit duck, hahaha, cheeky, lol, hehehe"
1220028319907447447.gif,"good, bunny chicken, cheer, happy, celebrate, joyful, jumping around happy"
1220028319907447599.gif,"peace, two, hey, sup, cool, peace sign, waving peace sign, cheese"
1220028319907447600.gif,"drawing on paper, busy writing, writing, rushing writing, furiously writing, dragon drawing lines on paper"
1220028319907447601.gif,"yellow dinosaur thumbs up, mmh mmh yes yes, good idea, good, nice, thumbs up, nodding thumbs up, thats right, you got it, ok ok can, thumbs up nodding, nailong thumbs up nod, uhhuh ok"
1220028319907448459.gif,"sad, tears, begging, deppressed, yellow, bird, cute, crying, yellow bird crying, sad bird, crying into a bowl"
1220028319907449861.gif,"sad, super sad, cry a lot, so sad, crying head down, bend over crying, kneeling in my own tears, sad max, wuwu, ðŸ˜­"
1220028319907449980.gif,"Nani, Bang wall, Arghhh, How can like that, Hit the wall, Angel, I cant believe it, I want to blame myself"
1220028319907449981.gif,"bye bye, waving, hello~, dinosaur yellow waving, Bye bye, See you, Come on, Let go, Angel"
1220028319907449984.gif,"cry wave, dinosaur cry wave, dinosaur crying, so sad, sad max, :(, sad wave, sad sad sad, non stop sadness, continuous sadness, wave of sadness"
1220028319907449987.gif,"Dinosaur laughing, Laughing so hard, Hand hit on floor, hit hand on floor laughing, hahahahaha, laugh so hard stomach hurts, yellow dinosaur"
1249949699201302698.png,"sad, duck, wuwu, wuwuwu, sad duck, sobs"
1269403972611866902.gif,"WHATTT, in shock, WAT, shocked, drop what im doing, what?, WHAT, horrified, ðŸ˜±"
1269403972611866955.gif,"thumbs up bubble, thumbs up dog, exploding thumbs up, thumbs up, ok, thumbs up burst, big thumbs up"
1269403972611866957.gif,"laughing, belly laughing, rhino lol, rhinosaurus laugh out loud, lmao max, laugh until belly hurts, hahahaha"
1269403972611866963.gif,"ugh whatever, spitting on ground, åèˆŒå¤´, digust, sick, tired, spit"
1269403972611867031.gif,"sus, thumbs up, bouncing with thumbs up, sus big thumbs up, good good, nice, awesome, body scanner ok thumbs up, body scanner thumbs up"
127870805718598328.png,"cry, no luck, waste time, cat, tearing"
1307127503596290066.png,"Hehehehe, See i so cute, Wearing red, Two ponytails, Smile smile, korean baby two ponytails, flowery red shirt"
1307127503596290082.png,"hehehhe, korean baby, im a pro, yada, baby wearing shades, cool korean baby, c:, cool beans, cool, two pony tails korean baby, feeling cool, dope, shades korean baby"
1307127503596290088.png,"heheh, smiley face, yay, :), smiling with eyes closed, chubby cheeks, smiling in the sun, happy, at peace, korean baby"
1307127503596290089.png,"Eat finish, æ²¡æ“¦å¹²å‡€, Eat until shiok shiok, Korean baby, è´ªåƒ, glutton, just ate, eating messy face baby"
1307127503596290093.png,"aiyo, aigooooo, awwww, :ooooo, /___\, korean baby, :3, baby wah, woahhhhh"
1307127503596290099.png,"Apply stuck in nose, apple in nostrils"
1307127503596290114.png,"laying hands back, you pro lol, you zai lol, say so much for what, you lol, chilling, lying on my back, zen, whats up, relax bro, you good"
1307127503596290146.png,":D, blushing cheeks, smiling, kpop baby, korean baby, smiling face, its ok, heheeheheh, show teeth korean baby smile"
1307127503596290179.png,"Vegetable at the back, Hehehehehe, Big smile"
1352098594324217913.png,"jio, kick you, kick fly, ç»™ä½ ä¸€jio, lets go!"
1360886329340072538.gif,":3, shivering while thinking, scared, shivering, then how?, sweating and shivering, bugcat capoo butthole mouth, nervous bugcat capoo, sweating"
1360886329340072541.gif,"capoo, body wave, bug cat, wiggly cat, dancing cat, waving"
1360886329340072542.gif,"hehehehe, small dot eyes, blur, clueless, lost, thinking, bugcat capoo holding phone laughhing"
1360886329340072544.gif,"yes~, haiya~, nodding, /__\, bowing, cug bat, capoo, /U\, :3, relax~"
1360886329340072557.gif,"thinking, handsome man thinking, capoo, bug cat, handsome bugcat capoo, bugcat capoo eh eh?, raise eyebrows smirk"
1360886329340072563.gif,"sweating in fear, nervous, worried, anxious, capoo, bug cat, :'3"
1360886329340072745.gif,"wiggling cat bug, happy cat, excited cat"
1360886329340072757.gif,"huh, shivering in fear, nervous, anxious, bug cat, capoo, mouth square capoo, oh no, worried, scared, frightened, how how?, what to do?, eyes turning white"
1360886329340072762.gif,"crying, sad, emo, left out, bugcat capoo, cri, cry, regret, my bad, teary eyed"
1360886329340073259.gif,"bugcat, capoo, twist, peace, proud, flex, wink, thats right, awesome~"
1360886329340073282.gif,"crying, thumbs up, cat, Yupp, Thats right, Cries, Tumbs up"
1360886329340073288.gif,"OH YEAHHHH, im feeling great, THIS IS GREAT, awesome, hands up, im so happy, so happy making face, Hands up, Thumbs up"
1360886329340073290.gif,"whatever, screw you, i hate you, go away, urgh, roll eyes, Blehhhhhhhh"
1360886329340073292.gif,"dig nose, hmmmm, judging"
1360886329340073302.gif,"cry, tears of joy, cat, Mouth big, Cries"
1391391008142393345.gif,"roll back laughing, wahahahahah, hahahaha, laughing, laugh until cry, HAHAHAHA, cherry ROFL, LOL, LMAO, GAGAHAHA"
1391391008142393347.gif,"frightened, scared, shiver in fear"
1391391008142393351.gif,"uwu, qwq, so sad, quivering, hands holding knees quivering, hands wrapped around knees"
1391391008142393358.gif,"sad, cry max, tears down my face, wuwuw, ww, cry, so sad, :("
1391391008142393363.gif,"yay, bouncing, happy, excited cherry, yippee, YAS, HEHE YES, YES, I WANT, NICE"
1391391008142393365.gif,"ok, thumbs up cherry, thumbs up, cherry, thumbs"
1391391008142393366.gif,"hehehehehe, big smile, BIG smile, :D, cherry BIG grin, smiling with teeth"
1391391008142393460.gif,"angry, done with life, joke, hmph, Joke, Clown"
1405493022157701125.gif,"dancing, meh, dancing frog, pepe, frog pepe dance"
142433042659541077.png,"Melody, Covers face, No eyes to see, melody, ashamed, upset, hands over face"
1432705458203787329.png,"tired anime girl, girl yawning, girl in pajamas, yawning, sleepy"
1471004892762996804.gif,"sliding downwards, urgh, i'm fine but not really, this sucks, feeling down, im fine (not really), sliding down stairs, urghhhhh"
1473773587595788332.png,"Fingers together, Hope hope, In PJs, On bed, duck hesistant, ermmmm goodnight, blush"
1494180970083909685.gif,"yayyyyy!!!, wowzies, sparkles, amazing!, bling eyes, awesome!, puppy excited"
1494180970083909716.gif,"wagging tail, take out knife, kill you, stab you, dont make me hurt you, stealth attack, attach when you dont notice, devious dog, imma stab you, knife you, whack you, threatening, peaceful threaten, turning face"
1494180970083909751.gif,"hahahaha, lmao, lmfao, lol, crying laughing, hahaha"
1527139887688450744.png,"brilliant idea, bingo, exactly, guessed it, you are right, bang, bang!, shoot you, point at you, finger gun, thats you, looking for you, you"
1556835416127045699.gif,"bleh bleh bleh, making ghost face, you can't fight me, you are the worst, i hate you, bleh, neninenipoopoo, ghost face, spitting, party hat"
1569031431030571585.png,"look up at sky, gritted teeth, Ugly anime, Teeth clenching, Eyes wide open, Guy"
1569031431030574524.png,"hahahaha, hugging tummy laughing, laughing shiba, shiba XD face, >.<"
1569031431030578602.png,"gigachad, strong anime character, ripped, strong, stronk girl, fight you, muscular, im ready to fight you, buff max"
1592756632805185994.gif,"zeh zeh zeh, oh yeah, wear glasses damn cool, disco vibes, im the winner, winner is me, disco bald guy, wear shades, cool, zeh zeh, disco lights, feeling good"
1592756632805186008.gif,"smile, sneaky smile, claps, clapping hands, sideeyes, clap, clapping hands together, yay, thank you, awesome, nice, hehe, bald guy blushy face clapping, hairless clapping"
1592756632805186042.png,"cry max, duck crying, so sad, sad :(, nanguo, sad duck, disappointed duck, duck with tears in eyes, tears in eyes, looking down"
1592756632805186050.png,"angry, im upset, how can you do this, sip tea, he!, upset, frowning, å“¼!, annoyed, frustrated, frustrated duck, upset duck, duck upset frowning"
1592756632805186051.png,"Smirk, Hehehe, Hands cover mouth, Duck, teehee shake shake, sneaky duck giggles, giggle teehee, silent giggles duck"
1592756632805186062.png,"question mark, ???, playing on phone, huh?, confused, annoyed, what?"
1592756632805186118.gif,"scratch myself, scratch armpit, scratching, frustrated, addicted"
1592756632805186122.gif,"nail file, side eye, file nails"
1592756632805186585.png,"drink beer, unbelievable, for real??, insane, madness, drink my sorrows, tears streaming down my face, upset"
1630841254575079609.gif,"bang bang bang, tututu, gunshots, lets do this!!!, do it!, fight you, shooting"
1630841254575079611.gif,"Positive reinforcement, Looking at mirror, Iâ€™m the best, Iâ€™m the cutest"
1630841254575079632.gif,"???, huh?, confused, im lost, blur max, clueless?"
1630841254575079641.gif,"hahaha, lmao, lol, hahahaha, lying on sofa laughing, throw back head laughing, throw back head sofa laughing"
1630841254575079651.gif,"angry, chinese, pressing chicken, squishy chicken, cannot wait, faster, hurry up, mad"
1630841254575079656.gif,"hahahahah, throw head back laughing, lmao, lmfao, hahahaha, lol, laughing with my head back, bald boy"
1630841254575080004.gif,"shaking side to side, chicken shaking side to side, yadayadayada, chicken dancing with helmet, excited, super fun, yay, happy"
1630841254575080023.gif,"sword, angry, running, running with knife, determined blob, running blob"
1630841254575080060.gif,"muak!, mua, blow u kisses, give u kisses, MUA!, thank u, love u, aini, blow kisses"
164681291080400937.png,"heart, bixin, hand heart, love u, thank you, hands heart, big heart, heart over head, love you, â¤ï¸, hands over head"
170087581164242210.png,"relax, ohhhh, laying down, chill, zen, dont move, not moving, staying very still, like a corpse"
1743031929264930892.png,"lee hsien loong, pap, how can, ??"
1768789062887407670.png,"Cat, With rope on neck, Looking up, White and black colour cat, sexy cat, attractive cat, seduce cat"
1801939437249101981.gif,"dead, soul coming out, delulu, disbelief, soul leaving me, tired, ç´¯"
182751983726232083.png,"scared, go away, ahhhhh, im scared, dw to know you"
182751983726232148.png,"shoot, kill me, shoot me, kms, kill myself, kill me right now"
182751983726232156.png,"oof, cat staring into the void, derp, aghast, wtf"
1833563040931381707.png,"yolo, hands up in the air, i promise you, yo, v shape hand sign, Wait for me, Hehe, I got you, Confident fox, Point to you"
1833563040931381708.png,"yada, so happy, oh yeah, smiley face, paw to cheek, haolian, show off"
1833563040931381709.png,"Thank you thank you, Friendly smile, Want something smile, Ok sure, Polite smile, mmmh, /w\, so happy, im excited, im glad, glad, feeling good, thats nice, nice"
1833563040931381710.png,"so cool, bling cool, wearing shades, lai lai, paws out, huehue, come come, HEH"
1833563040931381714.png,"hehe, æŽ¢å¤´, head sticking out, checking you out, checking it out, check it out, peeking, peekaboo, poking face out"
1833563040931381715.png,"sad face, feeling down, :<, upset, no feel good, feel no good, hais, sigh, liddat lol, like that bah, i guess its like this, zzz, looking to thee side, .., speechless, emotionless, cat looking to the side, ;<"
1833563040931381716.png,"look into the sky, why do you do this, paws into the sky, sad, eyes watery, looking at the sky, hug me, disappointed face, cat disappointed, help me, i need help, welp"
1833563040931381717.png,"Just watch show, Eat popcorn, Cat eat popcorn, popcorn, nom nom, tea"
1833563040931381719.png,"P2W, skill issue, smirk, cat, shrug, So?, Cat, Cute, What can you do?, Im the best, Arrogant, è‡ªè‚¥"
1833563040931381720.png,"Sleeping ah?, sleeping, taking a nap, take nap, in bed"
1833563040931381721.png,"stress, wipe, sweat, cat, forehead, Difficult, Struggle, Worry, Sweat, Working"
1833563040931381722.png,"hehehe, smirking, paw covering mouth, shy, blushing, cover mouth laughing, cover paw smile, blushing cat, >_<"
1833563040931381724.png,"Cat, Music notes, listening to music, chill, zen, resting, music cat"
1833563040931381725.png,"Go and die, åŽ»dieå§ä½ , Takes gun, Kill, Kill with a smile"
1833563040931381726.png,"Drink milk, drink milk, sip milk, hold cartoon, waiting, enen~, no problem"
1833563040931381727.png,"POLIS, REPORT, DULAN, police, catch you, arrest you"
1833563040931381728.png,"Angel, Halo above, Thank you very much, You are the best, Praying, pwease, please, pls, plz, cat please"
1833563040931381729.png,"drink coffee by the fire, sipping coffee, chill, chilling, cat drink coffee"
1833563040931381730.png,"ok, ok sign, ok de, can la, UwU, feeling at peace ok, OK, no problem, no worries, ofc, leave it to me, thats totally fine, thats fine, yes, ye, yeah, safe in my hands, cat ok sign"
1833563040931381735.png,"shy, hide face with hands, blushing, can have?, i also want, give me?, Shy, I want it too, Give me, Cute cat, Animal"
1833563040931381736.png,"Feeling rich, Show off, Show off the money, Show of the loots, give you money, give money, here's my money, take my money"
1833563040931381740.png,"salivating, i also want, i want, me want, blank eyes salivate"
1833563040931381741.png,"yapping, :O, D:, cat, huhhh"
1833563040931381748.png,"lie back, ded, dead, laying back, staring in the void, what am I doing, sian, lie down, no thoughts head empty"
1833563040931381749.png,"Kill you, Need to start killing people, How can like that, Very angry, Who is the one, kill you, stab you, threaten you, threatening, stab, cat holding knife evil expression"
1833563040931381751.png,"cry laugh, cat cry laugh, exasperated, cant help it, cry smile, realisation, so sad, puppy eyes sad"
1833563040931381752.png,"Smirk, Hand on cheek, éª„å‚², thinking, smirky, thats right, you got it, im good enough, fist under chin, wondering, leaning to a side, judging"
1833563040931381753.png,"Cat, Whack, Holds hammar, whack you, hammer you, take weapon fight, beat you"
1833563040931381758.png,"sad cat clown, sad clown, sad joker, cat sad clown, feeling down, :("
1833563040931381759.png,"Evil cat, Devil, You see, So?, cat shrug, devil cat shrug"
1833563040931381762.png,"Eat sweet, Time to eat sweet, happy cat, happy cat eating candy, munching, stuffing my face"
1833563040931381764.png,"hands up, BRUH, paws up, surrender, i give up, arrest me, cat paws up, im innocent, dont accuse me"
1833563040931381765.png,"oh no, how ah, dizzy eyes, hands on head, anxious, breakdown, exasperated, dizzy, unbelievable, unimaginable, unthinkable, why???, huh??, how is this possible?"
1833563040931381767.png,"dubbing cat, dub, yes, cat celebrating, step, swag, derp, hands up to the right"
1833563040931381768.png,"crown, yay, im the winner, winner, sponsor, rich, good, puppy eyes, wow!, amazing, splendid, thats great"
1833563040931381773.png,"huh?, what you talking about?, you sure not?, aiyo, karen vibes, tsk, annoying leh, annoyed, frustrated, urghh, annoying, disgruntled, unfair, annoyance"
1833563040931381795.png,"Haiyo, Sweat drop on forhead, Hand cover face, No words to say, Cat, facepalm, bruh"
1833563040931381796.png,"shatter, shattering, soul leaving my body, broken pieces, broken into pieces, disintegrated"
1833747660100599870.png,"farting, fat cat farting, boot, blushing fat cat fart"
1833747660100599875.png,"side eyes cat, hehehe, fat cat side eyes, side-eye, side eye, cat, fat, hehehehe, side eyes"
1833747660100599879.png,"thumbs up, star, cat, chubby cat thumbs up, awesome, that was awesome, satisfied"
1833747660100599880.png,"sad, fat cat, omg, noooo, cry, lying down"
1833747660100599883.png,"laughing, hilarious, funny, cartoon cat laughing, lol, lmao, rofl, cat laughs with big mouth"
1833747660100599887.png,"stun, double chin, fat cat, What you say?, Huh?, Double chin"
1833747660100599904.png,"pray, god bless me, chill, hands together, zenning, palms together, chilling, praying, fat cat praying, peace"
1833747660100599908.png,"fat cat lying on chair, zen, chill, relaxed, fat cat, fat cat lying back, chilling, relax, working but relax now, suited up cat"
1833747660100599936.png,"hmmm, considering, thinking, let me think, mmmh, frown thinking, fat cat thinking"
186649756741665162.gif,"HARHARHAR, braces, pepe, Laughing, Stupid frog"
1869834671106294051.png,"Fight fire, Time to fight, fight, shoot you, attac you, machine gun you, cat firing, shots fired"
187378887569703150.png,"praise the lord, yay!, stickman raising arms, relief, happy face, yay"
1899549922034712764.png,"huuuuuuuuuuh, pikachu, huh, whut, stretched out what pikachu, sad shocked pikachu"
1901206392136532027.gif,"hahahahah, rolling back laughing, ROFL, rofl, rolling peach laughing, lol, tears of joy, peach rofl, peach rolling in laughter, peach burst out in laughter"
1959275874691842146.png,"shoot me in the face, indian man, shoot me now, bruh, bro, er, um, è®©æˆ‘åŽ»æ­», Headshot"
1972079305345204241.png,"sad, sobbing, crying, disappoint, pokemon sad, pokemon sad tsum tsum, cries"
198787403039638196.png,"cry party girl, cry, sobs, party hat cry, i need it, me want, i want, crying"
1998657550815330339.png,"wheezing, pinching nose bridge, ahahhHAHAHAHAH, pinching nose, black man"
2011690508815958074.png,"thinking, let me think, platypus pokemon, confused, hands on head, confused duck"
2068366502116983013.png,"dead, pass away, kms, kill me please, kill me right now, hang myself, feeling dead, kill myself, kill me"
2068366502116983150.png,"aaaa, frustrating, annoying, dizzy, screams, AHHHHHHHH, scream my lungs out, aaaaa, scream"
2157482469304041485.gif,"fufufu, holding fish, cat big smile, happy, :D, Laughing, Cat with fish, Happy, Satisfied"
2157482469304041497.gif,"sad, cry, very sad, sigh, crying, sob, helpless, sad max, so sad, tears rolling down my face, sobs, cute"
2157482469304041516.gif,"????, turn back head, you talking to me?, eh?, listening, ?, calling me?, turn back"
2157482469304041518.gif,"sobbing, wipe tears, so sad, :(, upset, take tissue wipe tears, sad"
2182516944614195261.png,"heheheh, peekaboo, hahahahah, hiding behind door, shy, hehe"
2182516944614195294.png,"IDK, what do you mean?, what do you want?, huh, ??, question mark, hands in the air, baby"
2182516944614195333.png,"é¬¼è„¸, cute baby making face, cutiepie, cute, fingers on cheeks"
2193800188773011273.gif,"I want I want, carry me along, patpat, pompom"
2193800188773011470.gif,"dying, hanging upside down, swaying from branch, upside down, upside down swaying, chill, zen, relax"
2193800188773011597.gif,"hiyahh!, flying kick, brown bear kick white bear, Kick in face, Go die, You deserve it, Haiya!, Karate move, Died"
2193800188773011752.gif,"hehehe MWAHAHAHA, laughing bunny, evil bunny, evil laugh, HEHEHEHE, rabbit evil laugh"
2193800188773011871.gif,"sparkle sparkle, Twirl, yay yay happy, happy, brand new, shining, spinning, bright, sparkle, twirling, spin spin, sparkles, twirl"
2193800188773011896.gif,"dancing, teddy bear ears, skipping kitty, excited, waiting, kitty with bear hat"
2193800188773011897.gif,"laugh cat fall down, laughing cat, hahahaha, >_<, falling onto ground laughing"
2193800188773012057.gif,"cry, tears down my eyes, lying on pool of tears, cat in pool of tears"
2193800188773013007.png,"eating, eat pikachu cookie, nom, munching, nom nom, munching on cookie, delicious, hungry, chewing"
2211893026270216218.png,"crying, sobbing, sad, anime character crying, embarrased cry, shy, sad anime character, crying eyes, tears, water in my eyes, blonde anime character crying"
2267317642194845748.gif,"middle finger, troll face, Fuck you"
2267317642194845756.gif,"throw sad bag, feeling lonely, urgh, alone, only me, like this lol, like that lol, back towards you, back towards, showing back"
