sticker_id,labeled_queries
2267317642194845781.gif,"wink, if you know you know, stupidify"
2267317642194845796.gif,"flute, gorrila, harembe, Fuck you, Talk cock"
2267317642194845814.gif,"twerking, black bird, thumbs up, Black duck, Shake butt"
227521399969809576.png,"cry in my own tears, sitting in my own tears, sad max, sad, super sad"
234944112774611759.gif,"lick, disgusting, noice, nice, yummy, blue animal, lick your face, lick screen, tasty"
234944112774611771.gif,"mmmh, let me think, thinking, rubbing on chin"
2350329275443314871.png,"OHHHHH, sad face, cry, crying eyes, saaaaaadd, wide mouth open cry"
2350329275443314887.png,"gun, crying, smiley, shoot me, kill me, kms, reload shooting, sad"
2350329275443314933.png,"whew, side eye, wipe sweat, heng"
238234019068655424.png,"so full, im so full, satisfied, that was so good, lying on a mochi, hungry, eating, lying on mochi, full, stuffed"
238234019068655533.png,"happy to hear, happy to read, glad to read, lovely, sad, crying of joy, tears of joy, So cute, Looking at phone, Laugh crying, Guy with covered eyes"
247283906003337446.png,"disappoint, leave me alone, meditating, white cat, cat, squinting cat, ugly cat, old cat"
2480667625772810592.gif,"crying, puddle of tears, defeat, on the ground, Falls down, Crying, Nani, This is so sad"
2480667625772810593.gif,"ok, drawing ok, ok then, alright, no prob, uh huh, kk, okie, OK, NOTED, received, girl writing ok, understood, well noted, whiteboard, notebook"
2562980648230846730.gif,"ninja, crying, tantrum, failing leg, smacking hands, spider frustrated, oh no, damnit, i should have done this, urghhhh, frustrated"
263860190548328541.png,"cry blood, hand on face, red eye, mask, urghhhhhhhhh, cant believe it, pulling eyes with hands"
263860190548328549.png,"cry until rice become porridge, so sad, sad die me, urgh, sad max, bowing, shrug, cry cry max, cry max"
2643337197121437706.gif,"OH YEAH, æˆ‘å¤ªåŽ‰å®³å•¦, im the best, excited, so hype, å¤ªåŽ‰å®³å•¦, bugcat capoo, bugcat capoo so hype, stars in eyes excited"
2643337197121437728.gif,"çªè±ªå£æ€œ, i want to cry, shivering, crying, capoo, cat bug, feeling sad, quivering, teary eyes, sad"
273008397874367890.gif,"clapping, pepe, happy, cheer, Clap hands"
273008397874367917.gif,"run, pepe, legs, Frog running, Lets go"
2737268664460902429.gif,"heheheh, guilty, shifty, rubbing head, i guess, not sure, i guess?"
2879204968382857236.png,"hehehehe, sneaky smile, spy family, anya, evil smile, mysterious smile, smitty smile, heheheheh, sneaky laughter"
2887890281313599511.gif,"so close yet so far, super sad, crying max, puddle of tears, crying fat cat, crying a puddle, cat crying puddle on pillow"
289608858790265564.png,"hands on waist, zzz, speechless, emotionless, ..., =_=, annoyance, soccer field coach, unbelievable"
2916827172498833487.png,"bye, good bye, was good to know, nuff said"
2916827172498833535.png,"panda, badass panda, cool panda, instant noodle panda, thats amazing, wow, nice, amazeballs, eat instant noodles, thats awesone, shades, panda gangster character, shades gangster derp"
315339488169560410.png,"hi, hello, emotionless eyes hello, hands up hello, eh hi, creepy smile hi, hello it's me"
320794921269198941.png,"nuuuuuu, grrrrrrr, nuuuuuuu, noooooo, urghhhh, no wayyyyy, no way!, no, kwang soo, GRRRRRRRR, urghhhhhhh, nooooooo, nawrrrrrrr, nawr"
3212654065896919195.gif,"let's do this!, jiayou!, yes sir, salute, bear cat salute, got it, no problem, yes, ok"
3212654065896919665.gif,shooting arrows
3212654065896919669.gif,"sigh, lie down, done with life, animal, hais, haish, haiya, feeling down, feeling upset, upset, unhappy"
3212654065896919672.gif,"chuckle, hugging soft toy, worried, scared, close call, almost kenna"
3212654065896919681.gif,"sleeping bag, using phone, sleeping, lying down, staying awake at night"
3212654065896920972.gif,"that's right, you got it, finger guns, wink"
3212654065896920973.gif,"butt clap, heart, 2 cat, butt, booty, booty clap, cheeky butts, love, hearts"
3212654065896921380.gif,"woohoo, dancing, twirling skirt, yeepe~, finally, hawaii dance, flower dance, cute hip dance"
3212654065896921394.gif,toh
3244926458748993621.png,"weak smile, hiding behind blanket, thanks ah, heh, hesitation, hiding, shy, nervous, timid, introvert"
3302293271769776148.png,"Cat face down on road, Despair, Black hovering on top, ORZ, OTL, noooooooooo"
331131228218459239.png,"CMI, Cannot be, ä¸å¯èƒ½, impossibru, impossible"
331131228218459321.png,"swee, amazing, nice la, nice, good, gud, v good, thumbs up, ðŸ‘ðŸ»"
3323402744004894.gif,"cry, sad, wuwu, tears rolling down my face, doge, sobbssss, cryy, tears streaming down face"
3323402744004922.gif,"omgg, this is insane, insanity, madness, whut, diao, sweating profusely, that is insane, mad, crazy, wowz, totally mad, i cant believe it"
3323402744004924.gif,"xe xe xe, pro max, pro, amazing, hahahah, doge, im the pro, hands across chest"
3323402744004929.gif,"omg, ahhhhhh, omg omg omg, omg!, omgggg, madness, insane"
3323402744004931.gif,"eyebrows raised, examine you, stare intensively"
3423492769212006407.png,"v sign, yay, hehe, :3, korean baby, kid, victory hand, gang, cool, small child, confident, heart mouth, winkle"
3474244739891462431.png,"smile, c:, :>, hehe, eyes big big, hehe you know it, hehe big eyes chicken"
3504956075340201986.png,"mmmh, thinking hard, thinking HARD, spectacles glowing, hands together thinking, big eyes cat, thinking, wondering"
3545395176706933400.png,"hahahaha, loser~, hope you lose, wahhahaha, hate you, hands on stomach laughing, laugh, irony, go away"
3545395176706933437.png,"bleh, vomit, urgh, stupid, disgusting, troll, flex max?, flexer, zzz, roll eyes, annoyed, rolling eyes, boy rolling eyes in classroom, whatever, if you say so, yeah ok lol, heh"
3545395176706933449.png,"A old man, Light blue clothes, With bowl, blowing smoke ring, blow smoke ring out mouth, tired guy in blue"
359258651212383475.png,"shy, cover face, blush, hide face behind palms, sorry, embarrassed, ashamed rabbit"
359541685262226181.gif,"laugh until fall, hahahaha, fall down from laughing, laugh so hard fall down, laugh die me, LOL, laugh until fall down backwards"
365630041922470381.png,"running, following footsteps, going to play pokemongo, going to play pokemon, pokemon, interest, happy, enthousiastic, pokemon go, track, hunt"
365630041922470389.png,"oh yay!, awesome!, fantastic!, i got it!, sparkles, pokemon, show pokemon ball, misty, amazing, yay, happy"
365630041922470415.png,"Win, Champion, I did it, Tada, showing badge, see this, misty show badge"
365630041922470423.png,"thumbs up, ash pokemon thumbs up, ash pokemon big smile thumbs, ash, thanks up, ash grinning thumbs up, very good, nice!, awesome, thats great!, very nice, splendid"
365630041922470433.png,"Got it, Finally, Pokeball, I get it, Pokemon ball, Go!, This is the one, Here is it"
365630041922470449.png,"admire, notice me senpai, pokemon, pokemon purple eyes, pokemon popping out of phone, purple shiny eyes, yes, thats ok, wondering, puppy eyes"
365630041922470457.png,"confused, condusion, wth, explain plz, yellow duck, confused duck, psyduck, ???, scratching head"
365630041922470479.png,"evil pokemon, cheeky pokemon, bad, bad pokemon, gastly, pokemon, gengar mini, gengar dg"
379457349829526186.png,"cover hands with face, crying, sob, take a peek between hands, crying peeking through fingers"
4096777232716922896.png,"thumbups, ok, good, cute cat, thumbs up"
4110987462728221029.gif,"ha ha ha, cat lying down laugh, cartoon cat laughing, rofl, cat rofl, cartoon cat rofl, Hahahah, happy cat, you are funny, cute white cat"
4110987462728221300.gif,"happy, rabbit, bouncing rabbit, yay, bouncing around, hat cat bouncing, rabbit waddling, flowery hat, chilling, relaxing"
441671243897241893.gif,"clap, pepe frog, clap clap, sian but still need clap"
441671243897241910.gif,"shifty eyes, rocking side by side, pepe frog, pepe, heheheh, thats right, uh huh, oh yeah, awesome~, confident, smug pepe, iykyk"
441671243897241923.gif,"shooting, threatening, reckless, pepegagun, gun, frog, pepega, bang, stupid, anyhow shoot"
441671243897241939.gif,"Sit on chair, Shake legs, Frog, comfy in blanket, comfortable, im comfortable, wrap in blanket, very comfortable, chilling, pepe"
454054326101344499.png,"admire, bright eyed, impressed, pink blob, questioning, pink ball, :O, aaaa"
488038495349113481.png,"platypus side eyes, shifty eyes, awkward smile, heheheh, i got it, im the winner, psyduck, derp face, iykyk, hehehehee"
4902568730157908514.png,"heart, love, black bird heart, don't want to admit, mad love, thanks but mad"
4907045451879941139.png,"huhuo, look at hand, rings, sianz, Defend, :|"
4907084080815801337.png,"hmph, angry, angril anime girl, bossy anime girl, arms on hips, hands on hips, disappointed girl, frustrated blue anime girl"
4909308620472058340.png,"heart smiley, big eye, please, hearts, frowny emoji, low quality, deep fried"
4911271261612540311.png,"insane, omg, mindblown"
4927379596585730363.png,"smh, dissapointed, shoot you, statue shooting you, shoot me right now, no eyes to see, shooting"
4929254800782000444.png,"shock, unbelievable, crying, sobbing, omg"
4929498810758988185.png,"sus, shocked, black guy hesitate, unsure, uncertain, meme"
4936356718184498342.png,"emo, face wall, cry, sad, Sad sad, Face the wall, Im sad, Dont look at me"
4938207282153391325.png,"sianz, ..., money fly away, against wall, å«Œå¼ƒ"
4938246237506766030.png,"mmmh, thinking, staring"
4938634738773525128.png,"kickick rock on road, sad, done with life, sad cartoon girl walking, upset, kicking stone, mmmmh, feeling down, sigh"
4938678500195304002.png,"scared, nono, shaking in fear, so scared, not me please, shivering in fake"
4940620645751849572.png,"munching apple, mmh ok, crunching, yes, i agree, mm, nonchalant, apple, eat, ......"
4940719524488938584.png,"drinking tea, sipping tea, sipping hot tea, holding tea with both hands"
4940956941691126503.png,"SHOCK, anya, doom face"
4947221052708094454.png,"im cute, pointing finger to cheeks, kawaii desu ne, kawai, cutiepie, send love"
4947563151148188199.png,"wait, stop, hang on, wait for a moment, hands outwards to stop, Hold on a minute, Hands stop sign, Fan cover"
4949723365079253635.png,"smelling flowers, yay, be glad, happy, closed eyes, at peace, Anime, Genshin, Breathe, Holy"
4951817853125788758.png,"binance, doge, baby doge, banner, support, team, finance, crypto bro, doge team, doge banner, binance flag, baby doge together"
4952265272753914842.png,"bleh bleh bleh, im the winner, its me me me, sticking out tongue, bleh, tongue out"
4958975094002024771.png,"sian face, starring daggers, black guy, are you serious?"
4962981353596388167.png,scary mickey mouse
4972358186326557300.webm,"aaahhhh, why like this, im so upset, hands in the air, nooooo, yellow emoji hands up, why meeeee, exasperated, bouncing yellow emoji"
499916253176007558.gif,"support, thumbs up"
5003937646334968854.webm,"xoxo, kiss, happy, heart"
5006297382971769439.webm,"hi, hello, hey, nice to meet you, waving, hello~, hi!, paws waving"
5012542733571589183.webm,"NOOo, mad, exclaim, crazy, white eye, Arrr, Mouth big big"
5012693139031327649.png,"smart laugh, i see what you mean, cheeky, anime guy laughing, i see what you did, smirk, hehehe, chuckle, toji, cool, looking to the side"
5012911314780029638.png,"nonchalent, emotionless, whatever, urgh, heh, im so cool, cool toji, swanky"
5041849374196368231.webm,"cheers cheers, yay, bom boms, jy!, jiayou, you got this, cheering for you, cheer for you"
5062125214721114434.png,"hug, pepe, :), Frogs, Hugging, I got you"
5071183871979028853.png,"sobbing i love u, crying duck with hearts, sad, duck hearts, duck hearts sad, duck hearts sad tears"
5073327129379209878.png,"hands on chin, leaning on hand, if you say so, cool, confident"
5089182250260496985.png,"begging, pleace, pretty please, cute begging, Begging, Hands together, Genshin, Pray, Please"
5089225290127770152.png,"sad cry, kleef, rainclouds, Rain on me, Boohoo, ä¹Œäº‘å¯†å¸ƒ, Glooms over me"
5091430777309102619.png,"yay, celebrate, happy, exclaim, support, encouragement, yaaaaa!, >_<, yada~, hands in the air, LOL, thats funny, aah, blabla, excited, angry, not politically correc"
5091809666439054055.png,"wink, you're the best, awesome, that's me, sasuga amazing, amazing, Im the best, Wink wink"
5096369019036894340.webm,"HAHAHHAHAHAHAHAHHAHAHAHAHHAHAHAHHAHAHAHHAHA, lmao, rofl, lol, funny, laugh, anime girl laughing, redhead laughing, lmaoooo, belly laugh"
5103119054063796920.webm,"nai long, yellow dinosaur, yayyyy, yipee!, drooling, excited, full of excited, lets do this!!!"
5114328948771127638.png,"ahhhh, frustrated, turning blue from frustration, idk, dont ask me, urghhh"
5116148296917713523.png,"asian cat, mew, :3, heh, Cat looking, Uhhmmm, Smile smile, Devil look"
5116254940955672863.png,"angel, interested, starstruck, amazed, mesmerized, impressed"
5116630553025577257.png,"scared, bye, run, running away, sweating"
5120670772926349559.png,"huh?, which one, be clearer, zzzz, ..., speechless, Diao, Stares at you, :|"
5122894659747578197.png,"cartoon cat thumbs up, cat with hairy ear approves, approved, ok, received, noted, thumbs up, cat master approves, Good, thumb up, Big eyes, Cat girl"
5134136826839171947.png,"mouse, big eyes, sad big eyes, puppy eyes, boba eyes, sad hamster, pink bow hamster"
5140930872395957345.webm,"no way, are you for believe?, disbelief, uhhhh"
5143519019688526124.png,"it's going parabolic, elon mask, bald elon mask, hahahaha, derp elon, stupid face, retarded face, bold, Its going parabolic, Elon Musk"
5143615205481120075.png,"lmao, lol, shocked, crazy, rofl, shocked cat, screaming internally, ahhhhhh, nooooo, grey cat scream internally"
5152322998270690365.png,"momochan, hehehe, you're welcome~, hehe, mofusan, shy, paws covering mouth"
5161376900999808109.png,"eyes big, clueless, i'll admit it, its like this, idk what to do, don't know, confused, blur, confused mouse, hesitated mouse, worried mouse, blue mouse big eyes ears, O.O, honest mouse, nervous mouse, blue mouse nervous, OvO mouse"
5167882543797633865.webm,"urgh, annoying, roll eyes, zzzz, death"
5167932180734673468.webm,"heart, give heart, love you, agree, bixin, give you heart, â¤ï¸"
5167957825984397829.webm,"ahhhhhhh, zzzzzz, no way!!!, jesus, ahh, ugh!!!"
5167958693567791856.webm,"ahhhh, go sleep, zzzz, ..., sleep, sleepy liao, nap, good night, tired"
5167970285684523595.webm,"shy, hiding behind, hopeful, maybe?, can?, hiding behind door, i want but i shy"
5168130586748912290.webm,"heheeh, sneaky, cat smile, emotionless smile, :), speechless smile"
5168185068409062171.webm,"zoom zoom, whatever, chill, grooving to the music, party, zen, dog grooving, disco lights, disco, doge, dont care"
5168385974094267164.webm,"dead, roll eye, ehehehe, roll eyes, stick out tongue, wuyu, speechless, ..., zzz, unbelievable, are you for real, corgi"
5168389994183656137.webm,"dancing, disco, cat, happy, cat disco, disco lights, woohooo, yipee"
5168392846041940694.webm,"oh wowz, amazing, wow, hehehehe, oh shit"
5195221651314191918.png,"ok then, if you say so, dum, it is what it is, nonchalent, staring at the ceiling"
5195289584811915556.webm,"cool swag, remove jacket, bite, look at me, çœ‹æˆ‘çš„, hold my beer"
5197457757317370449.gif,"sad bee, sad, flying in the rain, raining, busy in the rain, bee, rain, thunder, lightning, bee in the rain, in the rain"
5197486039677018322.png,"cool boy, cool, sexy, cool guy, piercing blue eyes"
5197700289825620558.webm,"shake shake shake, fat cat dancing, fat cat paws on waist, fat cat shake belly"
5199486072802776012.webm,"hehehehe, thumbs up, head back smiling, Hahahhahaha, Me too, same here, Happy face, Greattt, Laughing, Thumb up"
5199516893488104544.webm,"sobbing, tears streaming down face, blue crown, cries, nooooo, :(, chibi"
5202214171604699176.webm,"noooooo, ehhhhhhh, how can like this, angry, swaying hands up and down, upset, ehhhhhhhhh, frustrated, hands waving up and down, nawwwwwwww, not fair"
5208603317709575362.png,"hehe, cool dude smile, handsome, charming, smile, anime man, :)"
5208764211479450935.webm,"nodding, sailor uniform, gif"
5211189235914117983.gif,"for your, both palms, for you, specially for you, only for you, open hands"
5215523807103565872.webm,"2 cat, black cat, deadpan"
5217577170838241432.webm,"blur face, cat, Stupid black cat"
5217660278455420714.webm,"dont tell you, dancing racoon, oh yeah, awesome~, fantastic, amazing"
5217666141085777105.webm,"confused cat, really?, what?, shocked cat, hUh?, confused, yawrrr"
5217748226500739939.webm,"mrow, sad cat meme, sad cat meowing, uwu, act cute, meow, Are you ok?, æ’’å¨‡, There there, Sad eyes, dont scold me"
5219689994100151030.webm,"cat coming close to camera, cat magnified, cat staring into camera"
5222427889722463681.png,"tongue to the sky, stick tongue out, tongue, playful, embarrased, shy"
5224223186052200035.gif,"strong, flex, ego, bunny, power, masculine, muscle cat"
5226527551970612153.webm,"dog under table, standing dog, are you for real, not sure, uncertain, under table, looking from behind"
5226746994734674777.gif,"hahaha, lmfao, laugh till tears come out, laffin, laugh until tears come out, hahahahaha, AHHAHAHA, lmao"
5228712307344819910.webm,"partyy, blue hair guy, happy, head in the skies, day dreaming"
5235815444518029481.webm,"punch punch punch, punching you, beat you up, beat you, fight you, whack you"
5238197373250841180.png,"doctor, heartbeat, psycho, check if you alive, got chance, dont die"
5242201725879716703.png,"heheheh, that's me, sarcastic, knife in my chest, kill me right now, tom, Kill enemy, Dying but not dying, Die with a smile, I am surviving well"
5242257410130715366.webm,"let's go, let's do this!, amazing!, yaaata!, yada!, i can do this!, i'll make it, let's do this, happy excited girl"
5242586361675927744.webm,"i'm fine, i'm good, genki desu, cheers, peace"
5242699851891745222.webm,"let me see, remove shades, take a closer look, whats going on, Pink hair girl, Taking off sunglasses, Coming out from dark, Hey"
5253454269612309105.webm,"vomit, cat vomit, bleh, gross, disgusting, uwhack, cat vomitting"
5254010235948909081.webm,"forced smile, death smile, Forced smile, Awkward smile, Yarr, Mmmhmmm"
5256261932683379786.webm,"squishy cat in hands, cat side by side, cuddling cat in hands, precious, Cute cat, Owner dancing the cat, Despair, Noooo, Why am i doing this, Forced"
5260334510867763449.webm,"sweating, acting blur, :), Forced smile, No eyes, Ok can"
5260470721460582281.webm,"sleepy, sleep, good night, lying down, zzzz, sleeping together"
526235993154519673.png,"bixin, æ¯”å¿ƒ, draw heart, big heart, heart heart, hands over head heart, heart, thank you!, give heart frog, thats great, you're the best, love you"
526235993154519697.png,"frog, twist, yeaa, peace sign"
5262925707587106705.webm,"shake shake, what is she doing?, characters staring at each other, looking left and right, changing characters"
5264731496521928466.png,"go to hell, go and die, go away, Go and die"
5273809884859615207.png,"can I help you?, mafia boss style"
5273811804709982368.gif,"thanks, thank you!!!, thanks~, tq, thank you, big thanks, firey thanks"
5273911795843600035.gif,"yes yes yes, fire nodding, sure, ofc, of course, excited fire, yes yes yes yes yes, excited fire clapping yes"
5274176490383100369.webm,"rock and roll, playing on the guitar, jamming, strumming guitar, lets do this, lets party, hyped, playing guitar, sped up, massive guitar, huge, random, excited, hell yeah"
5280573698141607344.png,"point, accuse, pointing, you"
5287433984978982047.webm,"orange girl hair, apathy, shrug, purple eyes no emotion gif"
5289672693732349888.webm,"nom nom, eating, see show, munching munching, munch, nomming, porcupine eating, happy eating porcupine"
5289862088905201398.webm,"bopping head side to side, heheh, its like that, hehe, anime girl, red hair, chibi"
5289967233999575505.webm,"mmmh, zooming in face, big eyes, zooming into camera, looking at you, let me see you, take a closer look"
5289974883336329087.webm,"slap, wake up your idea, smacking the camera gif, hitting the viewer gif"
5296271137888553567.webm,"delulu, delusional, copium, hoping, waving hangs, hello there, hi, hi anime girl"
5298905335820456314.png,"cool man, two fingers covering mouth, cover mouth, cool, sshh, shh, quiet, dont say anything"
5301271489138398007.gif,"frog changing color, urgh, damn it, frog become devil, angry, evil frog, turn into devil, devil, ðŸ˜ˆ"
5303194032464220303.webm,"I am a genius, pride, pretty girl, confident girl, confident, style, classy, glamour, anime blonde girl, sunshine baby"
5303258001707110413.gif,"BWSKFBEKFBSFJBDSKFDBFKSJDBF, angry max, !@#$%, frog on fire, ðŸ˜¡, ðŸ¤¬, angry frog, swearing, mad frog"
5307603537948069491.png,"hmmmm, hmm, air bangs, sigh, annoyed vibes, frustrated, korean bangs, m..m, eye brows raised"
5307796661152533370.png,"..., speechless, despair, carless anime guy, pale guy, expressionless, white anime character"
5312033813893749518.webm,"party, chilling, agree, cat jamming, cat bopping, catJAM"
5314407964440794292.gif,"fall asleep, can't be helped, sleeping beauty, sleepy, dizzy, confused, face slam on table"
5316919347782881871.png,"urgh, im so done with this, zzz, so done, cant wai, aight, tired, disappointed"
5317040349896526843.webm,"bite, ARGHMMM, vampire, å’¬ä½ , Bite you, Argh!!, Angry"
5318812307373954060.png,"haha, kidding, surrender, hands up, you got me, hands grabbing collar, im exposed, im caught"
5318840997755490193.png,"smirk, heh, if you say so, alright then, dead fish eyes, dead eyes, hmm, i see, sus, interesting, anime guy"
5318848969214792192.png,"fake surrender, not me, surrender, i didnt do that, im just playing along"
5318854475362865176.png,"hurt, bored, dead, Damaged, Hurt, Injured, Been through alot, dk what i been through"
5318860617166098398.png,"im here, pointing downwards, point down, here"
5319143505187049326.png,"sleep, bored, chilling in car, roadtrip, vibes, good vibes, relaxed, tired, chill anime, golden hour"
5319166040880451693.png,"death smile, :), Small smile, Eyes smiling, Read book"
5323307342836534653.gif,"thinking, math, spinning, hard problem, what could it be, mystery, calculating, thinking hard, mmmh, hands under chin"
5323579643763112217.webm,"i beg your pardon? teehee, pedro pascal and nicolas cage, pedro pascal driving meme, are u serious, nicolas cage driving meme, nicholas cage, staring at each other"
5325547756691917816.png,"aot, eren yeager, Guy falling"
5325913589121288372.png,"ðŸ‘‰ðŸ»ðŸ‘ˆðŸ», ðŸ¥¹, help, whelp, hesitation, shy emoji, embarrased emoji, pointing fingers at each other, touching fingers"
5334698266120436813.webm,"winking, amazing, Heart shape, Wink, Purple"
5341642983424927180.gif,"hahahahhaa, dog laughing while seating, thats so funny, hands on stomach, lmao, lol, dog laughing, hahahaha, hug tummy laughing, hold tummy laughing"
5341661468964169965.png,"hehe, oopsie, cheese, hamster cheese, hamster peace sign, yay, im happy, happy, awesome, noice, c:"
5345813237755562265.webm,"im angry!!!, fist in the air, upset, >_<, not happy, frustrated, no no no no, hands in the air, throwing tantrum, very upset, i want to complain"
5345984903303405074.png,"hidding pain, shadowed face, foreshadowing, hidden saddness, pretend to be fine, pretend, anime guy hidding pain, urgh, internal disgust, annoyance"
5348287765983279456.webm,"chilling, chill, carefree, simplton, bunny hopping, cute, bunny"
5348316082702666034.png,"read book, none of my business, Time to relax, æ¥read book"
534909855702450568.png,"sad, pepe sad, pepe vert sad, pepe looking down, sad pepe, pepe frown, fml"
5355249083336371075.webm,"looking up, looking to you, umbrella, grateful, blessed, cute anime girl, celestial, feeling thankful, girl in umbrella"
5355303217104170967.png,"hehe, smiles, thank you, i will, wish me luck, stars, Stars, Rub hands, Eyes got sparkle, Wear mask"
5363789101818455647.png,"yayyyyy, give hearts, im so happy, satisfied, hands wide open, hearts, reaching for hug"
5364248165102918884.png,"looking sideways, you know it, that's right, what are you hiding, shrek, are you sure, doubtful, dont wanna say, hesitation, uncertain"
5366085509162472295.gif,"give up, orange cat, devastated, cat, doomed, gg"
5366088953726252383.png,"give you present, thanks so much, here's a present, Genshin holding slime, Yeah!, Eyes big big, Mouth open, Smiling, Hehe!, gift for you!"
5368381379635581766.png,"sad, draw circle with finger, sorrowful, anime girl on her knees, pointing, look at this, this is so cute, i see"
5368393169320818229.gif,"noot!, shock by the news, dont know what to do"
5368403447177560301.webm,"dizzy, spinning, what???, nani???, @_@, crying, begging, unfair, salt, anime girl"
5368496420334617570.webm,"oh no, zoning out, staring into the void, uh oh, what's gonna happen next, oh shit, insane, why, anime girl confuse, confuse"
5368526601069805535.webm,"hello~, waving from afair, winter, Anime girl, Happily waving, Jumping"
5368654024159543458.webm,"smiling face, nice to meet you too, gentle smile, pure smile, nice to meet you~, smile, weixiao, blushing smile"
5368731625628644145.png,"give this to me, gimme this, give me your hands, hands out, protec, give me your hand, let me help you"
5370620878662938221.webm,"tweaking out, laughing in mic, weird filter funny, HAH, tart, iykyk"
5370766452284464113.webm,"smiley face, head to the side, gentle smile, polite smile, closed eye smile, nice smile, head tilting to the side, smiling head tilt to side"
5370774024311804192.webm,"i dont get it, lost, blinking eyes, im clueless, blinking blue hair, Blink blink, Emm"
